product_name,product_link,product_price(₹),product_ratings(out of 5),product_description,sub-category,Category,product_ids,comment_ids
BTS Heart Chocolate Cake,https://www.bookthesurprise.com/surprise/bts-heart-chocolate-cake/,1099.0,5.0,Heart shaped chocolate cake filled with more chocolate than you can imagine,online-cake-delivery-in-mumbai,Party-Surprises,6558,comment-9881
BTS Mixed Fresh Fruit Cake,https://www.bookthesurprise.com/surprise/bts-mixed-fresh-fruit-cake/,1099.0,5.0,"A mixed fruit cake with strawberries, pineapple and all the fruits you love",online-cake-delivery-in-mumbai,Party-Surprises,18282,comment-9938
BTS Blueberry Cake,https://www.bookthesurprise.com/surprise/bts-blueberry-cake/,1099.0,5.0,"Delicious, smooth and fluffy blueberry cake for friends and family",online-cake-delivery-in-mumbai,Party-Surprises,6524,comment-9940
BTS Dark Chocolate Magic Cake,https://www.bookthesurprise.com/surprise/bts-dark-chocolate-magic-cake/,1199.0,5.0,Dark chocolate magic cake for die hard chocolate lovers,online-cake-delivery-in-mumbai,Party-Surprises,6752,comment-9882
BTS Heart Shaped Black Forest Cake,https://www.bookthesurprise.com/surprise/bts-heart-shaped-black-forest-cake/,1199.0,5.0,Yummy heart-shaped black forest cake to make an occasion very special,online-cake-delivery-in-mumbai,Party-Surprises,18128,comment-9884
BTS Fruit Of Forest,https://www.bookthesurprise.com/surprise/bts-fruit-of-forest/,1199.0,5.0,"A mixed fruit cake with strawberries, pineapples, kiwis and much more",online-cake-delivery-in-mumbai,Party-Surprises,5932,comment-9886
Gem Topped Vanilla Cake,https://www.bookthesurprise.com/surprise/gem-topped-vanilla-cake/,1249.0,5.0,Delicious vanilla cake with the chocolate gems on the top,online-cake-delivery-in-mumbai,Party-Surprises,5982,comment-11101
BTS Chocolate Fantasy Cake,https://www.bookthesurprise.com/surprise/bts-chocolate-fantasy-cake/,1299.0,5.0,Live your fantasy with this delicious chocolate fantasy cake,online-cake-delivery-in-mumbai,Party-Surprises,17918,comment-9889
BTS Vanilla Chocolate Cake,https://www.bookthesurprise.com/surprise/bts-vanilla-chocolate-cake/,1299.0,5.0,Two of your favourite flavours chocolate and vanilla in one cake,online-cake-delivery-in-mumbai,Party-Surprises,6066,comment-9891
BTS Honey and Almond Cake,https://www.bookthesurprise.com/surprise/bts-honey-and-almond-cake/,0.0,5.0,"Note :- You can place your order any day, anytime but just before 4 hours of delivery. For midnight delivery contact us.",online-cake-delivery-in-mumbai,Party-Surprises,15928,comment-17493
Supreme White Delicacy,https://www.bookthesurprise.com/surprise/supreme-white-delicacy/,599.0,5.0,White chocolate cake that anyone would love to eat,online-cake-delivery-in-pune,Party-Surprises,5832,comment-10946
BTS Choco Velvette Cake,https://www.bookthesurprise.com/surprise/bts-choco-velvette-cake/,699.0,5.0,BTS special choco velvet cake loaded with all the chocolate you’ve dreamed of,online-cake-delivery-in-pune,Party-Surprises,5882,comment-9877
BTS Chocolate Delight,https://www.bookthesurprise.com/surprise/bts-chocolate-delight/,699.0,5.0,Chocolate delight cake perfect for chocolate lovers of all ages,online-cake-delivery-in-pune,Party-Surprises,6032,comment-9878
Classic Red Velvet Cake,https://www.bookthesurprise.com/surprise/classic-red-velvet-cake/,849.0,5.0,"Delicious, smooth and fluffy red velvet cake for friends and family",online-cake-delivery-in-pune,Party-Surprises,6134,comment-10669
BTS Chocolate Truffle Cake,https://www.bookthesurprise.com/surprise/bts-chocolate-truffle-cake/,899.0,5.0,This creamy and chocolaty choco truffle cake will make anyone happy,online-cake-delivery-in-pune,Party-Surprises,6168,comment-9880
BTS Lemon Blueberry Cake,https://www.bookthesurprise.com/surprise/bts-lemon-blueberry-cake/,949.0,5.0,Sweet and tangy lemon blueberry cake filled with loads of blueberries,online-cake-delivery-in-pune,Party-Surprises,15894,comment-9930
BTS Pineapple Awe,https://www.bookthesurprise.com/bts-pineapple-awe/,999.0,5.0,Delicious pineapple cake loaded with small pieces of pineapple and cherries,online-cake-delivery-in-pune,Party-Surprises,6100,comment-9874
BTS Butterscotch Tickle,https://www.bookthesurprise.com/surprise/bts-butterscotch-tickle/,999.0,5.0,BTS butterscotch cake for making a special occasion sweet and delightful,online-cake-delivery-in-pune,Party-Surprises,6362,comment-9876
BTS Butterscotch delight,https://www.bookthesurprise.com/surprise/bts-butterscotch-delight/,999.0,5.0,Tasty and creamy butterscotch cake that your dear one will love,online-cake-delivery-in-pune,Party-Surprises,6558,comment-9879
BTS Heart Chocolate Cake,https://www.bookthesurprise.com/surprise/bts-heart-chocolate-cake/,1099.0,5.0,Heart shaped chocolate cake filled with more chocolate than you can imagine,online-cake-delivery-in-pune,Party-Surprises,18282,comment-9881
BTS Mixed Fresh Fruit Cake,https://www.bookthesurprise.com/surprise/bts-mixed-fresh-fruit-cake/,1099.0,5.0,"A mixed fruit cake with strawberries, pineapple and all the fruits you love",online-cake-delivery-in-pune,Party-Surprises,6524,comment-9938
BTS Blueberry Cake,https://www.bookthesurprise.com/surprise/bts-blueberry-cake/,1099.0,5.0,"Delicious, smooth and fluffy blueberry cake for friends and family",online-cake-delivery-in-pune,Party-Surprises,6752,comment-9940
BTS Dark Chocolate Magic Cake,https://www.bookthesurprise.com/surprise/bts-dark-chocolate-magic-cake/,1199.0,5.0,Dark chocolate magic cake for die hard chocolate lovers,online-cake-delivery-in-pune,Party-Surprises,15873,comment-9882
BTS Heart Shaped Black Forest Cake,https://www.bookthesurprise.com/surprise/bts-heart-shaped-black-forest-cake/,1199.0,5.0,Yummy heart-shaped black forest cake to make an occasion very special,online-cake-delivery-in-pune,Party-Surprises,15879,comment-9884
BTS Fruit Of Forest,https://www.bookthesurprise.com/surprise/bts-fruit-of-forest/,1199.0,5.0,"A mixed fruit cake with strawberries, pineapples, kiwis and much more",online-cake-delivery-in-pune,Party-Surprises,15863,comment-9886
Gem Topped Vanilla Cake,https://www.bookthesurprise.com/surprise/gem-topped-vanilla-cake/,1249.0,5.0,Delicious vanilla cake with the chocolate gems on the top,online-cake-delivery-in-pune,Party-Surprises,15827,comment-11101
BTS Chocolate Fantasy Cake,https://www.bookthesurprise.com/surprise/bts-chocolate-fantasy-cake/,1299.0,5.0,Live your fantasy with this delicious chocolate fantasy cake,online-cake-delivery-in-pune,Party-Surprises,15848,comment-9889
BTS Vanilla Chocolate Cake,https://www.bookthesurprise.com/surprise/bts-vanilla-chocolate-cake/,1299.0,5.0,Two of your favourite flavours chocolate and vanilla in one cake,online-cake-delivery-in-pune,Party-Surprises,15833,comment-9891
BTS Honey and Almond Cake,https://www.bookthesurprise.com/surprise/bts-honey-and-almond-cake/,0.0,5.0,"Note :- You can place your order any day, anytime but just before 4 hours of delivery. For midnight delivery contact us.",online-cake-delivery-in-pune,Party-Surprises,15853,comment-17493
BTS Charming Red Roses,https://www.bookthesurprise.com/surprise/bts-charming-red-roses/,399.0,5.0,A bouquet of 8 charming red roses packed with red packing paper,online-flower-delivery-in-bangalore,Flowers,15822,comment-9765
BTS Desirable Yellow Roses,https://www.bookthesurprise.com/surprise/bts-desirable-yellow-roses/,399.0,5.0,A bouquet of 8 charming yellow roses packed with yellow packing paper,online-flower-delivery-in-bangalore,Flowers,15843,comment-9894
BTS Beautiful Pink Combination,https://www.bookthesurprise.com/surprise/bts-beautiful-pink-combination/,549.0,5.0,A bouquet of 10 charming pink carnations packed with pink packing paper,online-flower-delivery-in-bangalore,Flowers,17141,comment-9896
BTS Charm,https://www.bookthesurprise.com/surprise/bts-charm/,599.0,5.0,A bouquet of charming pink roses packed with fillers and packed with pink packing paper,online-flower-delivery-in-bangalore,Flowers,15838,comment-9898
BTS Beautiful Carnation Bunch,https://www.bookthesurprise.com/surprise/bts-beautiful-carnation-bunch/,599.0,5.0,A bouquet of 12 charming red carnations and fillers packed with red packing paper,online-flower-delivery-in-bangalore,Flowers,15858,comment-9900
BTS Pretty In Pink,https://www.bookthesurprise.com/surprise/bts-pretty-in-pink/,699.0,5.0,A cute basket of 8 pink and 4 white carnations with fillers,online-flower-delivery-in-bangalore,Flowers,15868,comment-9902
BTS Amezing Carnation Carnival,https://www.bookthesurprise.com/surprise/bts-amezing-carnation-carnival/,749.0,5.0,A bouquet of 15 charming pink carnations and fillers packed with blue packing paper,online-flower-delivery-in-bangalore,Flowers,15817,comment-9904
BTS Perform My Love,https://www.bookthesurprise.com/surprise/bts-perform-my-love/,799.0,5.0,A beautiful flower arrangement of roses that your dear one will love,online-flower-delivery-in-bangalore,Flowers,15812,comment-9906
BTS A True Hug,https://www.bookthesurprise.com/surprise/bts-a-true-hug/,899.0,5.0,A bouquet of 20 charming pink carnations packed with white packing paper,online-flower-delivery-in-bangalore,Flowers,15873,comment-9908
BTS Perfect Charm Bouquet,https://www.bookthesurprise.com/surprise/bts-perfect-charm-bouquet/,899.0,5.0,A bouquet of charming orchids packed with pink packing paper,online-flower-delivery-in-bangalore,Flowers,15879,comment-9910
BTS Lovely Pink,https://www.bookthesurprise.com/surprise/bts-lovely-pink/,949.0,5.0,A beautiful flower arrangement of pink roses that your dear one will love,online-flower-delivery-in-bangalore,Flowers,15863,comment-9912
BTS Romantic Love,https://www.bookthesurprise.com/surprise/bts-romantic-love/,949.0,5.0,A cute basket of 20 pink carnations decorated with green fillers,online-flower-delivery-in-bangalore,Flowers,15827,comment-9914
BTS Memorable Expression,https://www.bookthesurprise.com/surprise/bts-memorable-expression/,949.0,5.0,A bouquet of 10 charming red roses decorated with fillers and packed with red packing paper,online-flower-delivery-in-bangalore,Flowers,15848,comment-9916
BTS Wonderful Twenty,https://www.bookthesurprise.com/surprise/bts-wonderful-twenty/,1049.0,5.0,A bouquet of 20 long stem red roses decorated with fillers and packed with orange packing paper,online-flower-delivery-in-bangalore,Flowers,15833,comment-9918
BTS A BIG Affection N Love,https://www.bookthesurprise.com/surprise/bts-a-big-affection-n-love/,2399.0,5.0,A huge bouquet of 50 red roses to show your heartfelt affection,online-flower-delivery-in-bangalore,Flowers,15853,comment-9920
BTS Charming Red Roses,https://www.bookthesurprise.com/surprise/bts-charming-red-roses/,399.0,5.0,A bouquet of 8 charming red roses packed with red packing paper,online-flower-delivery-in-hyderabad,Flowers,15822,comment-9765
BTS Desirable Yellow Roses,https://www.bookthesurprise.com/surprise/bts-desirable-yellow-roses/,399.0,5.0,A bouquet of 8 charming yellow roses packed with yellow packing paper,online-flower-delivery-in-hyderabad,Flowers,15843,comment-9894
BTS Beautiful Pink Combination,https://www.bookthesurprise.com/surprise/bts-beautiful-pink-combination/,549.0,5.0,A bouquet of 10 charming pink carnations packed with pink packing paper,online-flower-delivery-in-hyderabad,Flowers,17141,comment-9896
BTS Charm,https://www.bookthesurprise.com/surprise/bts-charm/,599.0,5.0,A bouquet of charming pink roses packed with fillers and packed with pink packing paper,online-flower-delivery-in-hyderabad,Flowers,15838,comment-9898
BTS Beautiful Carnation Bunch,https://www.bookthesurprise.com/surprise/bts-beautiful-carnation-bunch/,599.0,5.0,A bouquet of 12 charming red carnations and fillers packed with red packing paper,online-flower-delivery-in-hyderabad,Flowers,15858,comment-9900
BTS Pretty In Pink,https://www.bookthesurprise.com/surprise/bts-pretty-in-pink/,699.0,5.0,A cute basket of 8 pink and 4 white carnations with fillers,online-flower-delivery-in-hyderabad,Flowers,15868,comment-9902
BTS Amezing Carnation Carnival,https://www.bookthesurprise.com/surprise/bts-amezing-carnation-carnival/,749.0,5.0,A bouquet of 15 charming pink carnations and fillers packed with blue packing paper,online-flower-delivery-in-hyderabad,Flowers,15817,comment-9904
BTS Perform My Love,https://www.bookthesurprise.com/surprise/bts-perform-my-love/,799.0,5.0,A beautiful flower arrangement of roses that your dear one will love,online-flower-delivery-in-hyderabad,Flowers,15812,comment-9906
BTS A True Hug,https://www.bookthesurprise.com/surprise/bts-a-true-hug/,899.0,5.0,A bouquet of 20 charming pink carnations packed with white packing paper,online-flower-delivery-in-hyderabad,Flowers,17651,comment-9908
BTS Perfect Charm Bouquet,https://www.bookthesurprise.com/surprise/bts-perfect-charm-bouquet/,899.0,5.0,A bouquet of charming orchids packed with pink packing paper,online-flower-delivery-in-hyderabad,Flowers,17657,comment-9910
BTS Lovely Pink,https://www.bookthesurprise.com/surprise/bts-lovely-pink/,949.0,5.0,A beautiful flower arrangement of pink roses that your dear one will love,online-flower-delivery-in-hyderabad,Flowers,17663,comment-9912
BTS Romantic Love,https://www.bookthesurprise.com/surprise/bts-romantic-love/,949.0,5.0,A cute basket of 20 pink carnations decorated with green fillers,online-flower-delivery-in-hyderabad,Flowers,17669,comment-9914
BTS Memorable Expression,https://www.bookthesurprise.com/surprise/bts-memorable-expression/,949.0,5.0,A bouquet of 10 charming red roses decorated with fillers and packed with red packing paper,online-flower-delivery-in-hyderabad,Flowers,17675,comment-9916
BTS Wonderful Twenty,https://www.bookthesurprise.com/surprise/bts-wonderful-twenty/,1049.0,5.0,A bouquet of 20 long stem red roses decorated with fillers and packed with orange packing paper,online-flower-delivery-in-hyderabad,Flowers,17681,comment-9918
BTS A BIG Affection N Love,https://www.bookthesurprise.com/surprise/bts-a-big-affection-n-love/,2399.0,5.0,A huge bouquet of 50 red roses to show your heartfelt affection,online-flower-delivery-in-hyderabad,Flowers,17686,comment-9920
Open Me Birthday Surprise,https://www.bookthesurprise.com/surprise/open-me-birthday-surprise/,3999.0,5.0,Open me balloon surprise gift comes in an exciting surprise box that is filled with something really unexpected which makes the receiver wonder what is inside the box!,open-me-balloon-surprises,Balloon-Surprises,17691,comment-10774
Open Me – Say Miss you,https://www.bookthesurprise.com/surprise/open-me-say-miss-you/,3999.0,5.0,The void of emptiness that you get when you miss someone can only be filled with some surprise gifts that let your dear ones know how much their presence means to you! Open me balloon surprise gift is one such amazing gifting idea that will perfectly convince your loved one that you always run in their thoughts.The best and surprising miss you gift that you can give them is this special open me box that is filled with some lovely balloons and a heart touching message.The box can also be customized with some lovely photographs of yours. The box comes with a specially designed miss you balloon.You can choose the balloons surprise box of your favourite colour.,open-me-balloon-surprises,Balloon-Surprises,17758,comment-10590
Open Me – Send New Born Wishes,https://www.bookthesurprise.com/surprise/open-me-send-new-born-wishes/,3999.0,5.0,Send special wishes to the new parents by gifting them with a colorful balloon box and make their day much more exciting.,open-me-balloon-surprises,Balloon-Surprises,26972,comment-10776
Open Me – I Love You Gift,https://www.bookthesurprise.com/surprise/open-me-i-love-you-gift/,3999.0,5.0,Keeping up the real spark in your love life is no longer a tough task! All you need is a lovely reminder to let your special someone know that you still love them with the same amount of energy and enthusiasm that you had in the beginning.,open-me-balloon-surprises,Balloon-Surprises,18383,comment-10549
Open Me – Send Congratulations,https://www.bookthesurprise.com/surprise/open-me-send-congratulations/,3999.0,5.0,"Say congratulations like you have never said before! Send an interesting balloon surprise box that is printed with the words “Open me” as a special surprise gift to your beloved. As the receiver opens the box, he/she gets a beautiful glimpse of special wishes printed on one side of the box.The other side is decorated with cute photographs and the box is completely filled with some colourful balloons and a cute teddy. Along with the box comes an attractive balloon especially designed with the word “Congratulations” on it.Order an exciting surprise box of your colour choice and immerse your dear ones in a pool of joy!",open-me-balloon-surprises,Balloon-Surprises,22938,comment-10550
Open Me – Apology Gift,https://www.bookthesurprise.com/surprise/open-me-apology-gift/,3999.0,5.0,Nothing heals a broken soul like words do. Choose the most heart touching gift to send apologies to the ones whose relationship with you is utmost special. Open me balloon surprise gift is an amazing way of saying sorry since the receiver opens the box to witness a bunch of colourful balloons and a lovely message that you are willing to sayThe message is personalized and you get a specially designed balloon that says ‘Sorry’ to make your greetings seem more appealing.There are some selective colours available among which you can choose your favourite colour.,open-me-balloon-surprises,Balloon-Surprises,18377,comment-10545
Open Me – Say Get Well Soon,https://www.bookthesurprise.com/open-me-say-get-well-soon/,3999.0,5.0,"Wish your dear ones with a get well soon message in the form of a loveliest balloon surprise gift that is enclosed with sweet and uplifting message. The box that is titled “Open me” is filled with some lovely surprise gifts accessories like teddy and balloons.As the receiver opens the box, the most comforting get well soon message pops up along with balloons and a cute teddy!There comes as special balloon that displays “Get well soon” message on it. This unique idea of balloon surprise gift is surely the most comforting way to wish someone a speedy recovery.You can order for the balloon surprise box that is of your favourite colour!",open-me-balloon-surprises,Balloon-Surprises,22864,comment-10546
Open Me – Anniversary Surprise,https://www.bookthesurprise.com/surprise/open-me-anniversary-surprise/,3999.0,5.0,Make your anniversary celebrations the best memory of your life with this exciting balloon surprise concept of open me! Send this special surprise box printed with the words “Open me” to your loved ones place and leave him/her completely curious!,open-me-balloon-surprises,Balloon-Surprises,22869,comment-10547
Open Me – Say Thank You,https://www.bookthesurprise.com/surprise/open-me-say-thank-you/,3999.0,5.0,"Wondering how to say Thank you? Here comes the most exciting balloon surprise gifting concept that makes your wishes lively and fun filled! Send a compelling balloon surprise box that reads “Open Me” As the receiver opens the box, he gets to read a lovely “Thank you” message on one side of the box and some interesting photographs attached to other side of the box. The box is also stuffed with some colourful balloons to make the entire gift appear eye catchy! There is an additional “Thank you” balloon which altogether makes the gift perfectly mesmerising! You can choose the colour of the box as per your interest.",open-me-balloon-surprises,Balloon-Surprises,22868,comment-10548
Black Ink Caricature,https://www.bookthesurprise.com/surprise/black-ink-caricature/,1999.0,5.0,One couple caricature mug,personalized-caricatures-online,Surprise-Gifts,28719,comment-11990
Caricature Photo Frame!,https://www.bookthesurprise.com/surprise/caricature-photo-frame/,2499.0,5.0,One couple caricature frame,personalized-caricatures-online,Surprise-Gifts,17409,comment-11987
Sibling Love Caricature,https://www.bookthesurprise.com/surprise/sibling-love-caricature/,4999.0,5.0,no description,personalized-caricatures-online,Surprise-Gifts,17357,comment-17786
Photo In a Jar,https://www.bookthesurprise.com/surprise/photo-in-a-jar/,399.0,5.0,Store a cute memory in a jar with this photo in a jar gift so that you can cherish it forever,personalized-gifts,Surprise-Gifts,17359,comment-10375
I Love This Peeling – Let’s Stick Together,https://www.bookthesurprise.com/surprise/i-love-this-peeling,499.0,5.0,Adorable Fridge magnet that can be customised with a cute photo of the two of you.,personalized-gifts,Surprise-Gifts,17362,comment-10223
My Majes-tea Mug,https://www.bookthesurprise.com/surprise/my-majes-tea-mug/,499.0,5.0,Lost Your Heart To Someone? Let Them Know Your Feelings With This Beautiful Custom Coffee Mug,personalized-gifts,Surprise-Gifts,17364,comment-10298
Brew-Tiful Love,https://www.bookthesurprise.com/surprise/brew-tiful-love/,499.0,5.0,Get Your Love Brewing Everyday With This Customisable Coffee Mug! ,personalized-gifts,Surprise-Gifts,17368,comment-10299
Hey Hot-Tea,https://www.bookthesurprise.com/surprise/hey-hot-tea/,499.0,5.0,A Personalised Hot-Tea Mug for The Hottie of Your Life! ,personalized-gifts,Surprise-Gifts,17369,comment-10301
Pikachu – I Choose You,https://www.bookthesurprise.com/surprise/pikachu-i-choose-you/,499.0,5.0,Did You Pika’Choose’ Your Special Someone? Here’s A Customisable Fridge Magnet to Express Your True Love! ,personalized-gifts,Surprise-Gifts,17259,comment-10318
Hyderabadi – Kiraak Hyderabadi,https://www.bookthesurprise.com/surprise/hyderabadi-kiraak-hyderabadi/,499.0,5.0,Your Kiraak Hyderabadi Friend Deserves This Aakhri Photo Magnet! ,personalized-gifts,Surprise-Gifts,17370,comment-10319
You Are My Marvel – The Marvelous Two,https://www.bookthesurprise.com/surprise/you-are-my-marvel-the-marvelous-two/,499.0,5.0,Marvellous Custom Magnet for Your Partner Who is A Hardcore Marvel Fan! ,personalized-gifts,Surprise-Gifts,17400,comment-10321
Dead Cool – Chilling In Love,https://www.bookthesurprise.com/surprise/dead-cool-chilling-in-love/,499.0,5.0,Super-Cool Customisable Fridge Magnet For Someone Who is Deadcool!!,personalized-gifts,Surprise-Gifts,18500,comment-10322
Berry Much Love,https://www.bookthesurprise.com/surprise/berry-much-love/,499.0,5.0,Customisable Magnet For Someone Who Means The World To You! ,personalized-gifts,Surprise-Gifts,17185,comment-10323
You Are My Soymate,https://www.bookthesurprise.com/surprise/you-are-my-soymate/,499.0,5.0,Photo Magnet With Some Clever Food Puns to Win Your Partner’s Heart! ,personalized-gifts,Surprise-Gifts,17249,comment-10324
Central Perk – I’ll Be There For You,https://www.bookthesurprise.com/surprise/central-perk,499.0,5.0,Know a F.R.I.E.N.D.S fan? Make their little heart much happy with this customisable fridge magnet ,personalized-gifts,Surprise-Gifts,17281,comment-10325
My Cup Of Tea,https://www.bookthesurprise.com/surprise/my-cup-of-tea/,599.0,5.0,How Well Do You Know Your Favourite Person? Get Their Likes Printed On This Cute Coffee Mug! ,personalized-gifts,Surprise-Gifts,17309,comment-10297
Magnet Mémoire – Moments in Magnets,https://www.bookthesurprise.com/surprise/moments-in-magnets/,799.0,5.0,Let The Memories Stick With You Forever – Order a Box of Customisable Fridge Magnets ,personalized-gifts,Surprise-Gifts,17507,comment-10369
Love Journal,https://www.bookthesurprise.com/surprise/love-journal/,799.0,5.0,"Set of 7 romantic letters for your love, each of the love letters have a different theme",personalized-gifts,Surprise-Gifts,17575,comment-10401
Gift A Mini Biopic,https://www.bookthesurprise.com/surprise/gift-a-mini-biopic/,799.0,5.0,How Would Your Love Story Look if It Were A Romantic Movie? ,personalized-gifts,Surprise-Gifts,17240,comment-13472
Photo Easels,https://www.bookthesurprise.com/surprise/photo-easels/,899.0,5.0,"Small, cute easels that can be customised with you and your loved one’s photo",personalized-gifts,Surprise-Gifts,17255,comment-10228
Years of Togetherness,https://www.bookthesurprise.com/surprise/years-of-togetherness/,999.0,5.0,Anniversary Frame to Count Every Second of Your Togetherness! ,personalized-gifts,Surprise-Gifts,17513,comment-10278
Monogram Cushion,https://www.bookthesurprise.com/surprise/monogram-cushion/,999.0,5.0,Your Favourite Alphabet + Your Favourite Letter = A Deadly Combination on A Cushion! ,personalized-gifts,Surprise-Gifts,17229,comment-10305
All About You – Personalized Cushion,https://www.bookthesurprise.com/surprise/all-about-you-personalized-cushion/,999.0,5.0,A Cushion That Speaks About You/Your Favourite Person! Customise it Today! ,personalized-gifts,Surprise-Gifts,17277,comment-10306
Photo Film Book,https://www.bookthesurprise.com/surprise/photo-film-book/,999.0,5.0,Know Someone Who is Super-Cute? This Box of Cuteness is What They Expect From You! ,personalized-gifts,Surprise-Gifts,18111,comment-10403
Your Name in Dictionary,https://www.bookthesurprise.com/surprise/your-name-in-dictionary/,999.0,5.0,If Dictionary Had Your Name – This is How It Would Look Like! ,personalized-gifts,Surprise-Gifts,18522,comment-10433
Name in the Frame,https://www.bookthesurprise.com/surprise/name-in-the-frame/,1299.0,5.0,The Best Way to Make Someone Feel Super-Special Is to Get Their Name Framed With Their Beautiful Pictures! ,personalized-gifts,Surprise-Gifts,17697,comment-10282
Mosaic Photo Art,https://www.bookthesurprise.com/surprise/mosaic-photo-art/,1499.0,5.0,Countless Beautiful Memories In A Single Masterpeice! ,personalized-gifts,Surprise-Gifts,17733,comment-10281
The Love Grill,https://www.bookthesurprise.com/surprise/the-love-grill/,1499.0,5.0,"A grill filled with romantic photos of you can your loved one, displayed in a cute way",personalized-gifts,Surprise-Gifts,17738,comment-10404
