product_name,product_link,product_price(₹),product_ratings(out of 5),product_description,sub-category,Category,product_ids,comment_ids
Customized Rakhi,https://www.bookthesurprise.com/surprise/customized-rakhi/,499.0,5.0,"What better way to celebrate their conscience than dedicating a tree in their name? It is a thoughtful and empathetic thing to do, considering that our planet is going through a climate change crisis as we speak!",gifts-for-brother,Surprise-Gifts,18660,comment-17794
Personalized Rakhi,https://www.bookthesurprise.com/surprise/personalized-rakhi/,499.0,5.0,"This detailed and artistic photo piece includes everything about your brother, be it his hobbies, interests and likings. So, what better way is there to celebrate your bond every single day? ",gifts-for-brother,Surprise-Gifts,18668,comment-17795
Sweet Brother Rakhi,https://www.bookthesurprise.com/surprise/sweet-brother-rakhi/,499.0,5.0,"Then, you can surprise him further with 2 customised fridge magnets with his picture on them! This way, you can mark some memories forever. ",gifts-for-brother,Surprise-Gifts,18675,comment-17796
I Love My Brother T-Shirt,https://www.bookthesurprise.com/surprise/i-love-my-brother-t-shirt/,599.0,5.0,"The expertly made caricature comes in high resolution and will surely look good while on display. So, make your brother’s Raksha Bandhan more special with this creative portrait. ",gifts-for-brother,Surprise-Gifts,18740,comment-13539
Comic Tag Badges For Sibling,https://www.bookthesurprise.com/surprise/comic-tag-badges-for-sibling/,699.0,5.0,"Blow their mind away with this innovative gift, through which they will receive a certificate and a fact sheet which identifies their namesake star. Along with this comes a heartfelt note with a decorated frame, which expresses your feelings for your sibling. ",gifts-for-brother,Surprise-Gifts,18649,comment-17793
The Annoying Brother Frame,https://www.bookthesurprise.com/surprise/the-annoying-brother-frame/,899.0,5.0, A picture of you and your sibling. ,gifts-for-brother,Surprise-Gifts,18637,comment-17801
Dedicate A Tree –  Go Green in Love!,https://www.bookthesurprise.com/surprise/dedicate-a-tree-go-green-in-love/,999.0,5.0,no description,gifts-for-brother,Surprise-Gifts,18316,comment-11634
All About Brother – Customized Cushion,https://www.bookthesurprise.com/surprise/all-about-brother-customized-cushion/,999.0,5.0,no description,gifts-for-brother,Surprise-Gifts,18559,comment-17803
Dedicate A Tree For Brother/Sister,https://www.bookthesurprise.com/surprise/dedicate-a-tree-for-brother-sister/,999.0,5.0,no description,gifts-for-brother,Surprise-Gifts,18569,comment-13541
Brother Monogram Cushion,https://www.bookthesurprise.com/surprise/brother-monogram-cushion/,999.0,5.0,no description,gifts-for-brother,Surprise-Gifts,18583,comment-17805
Box Loaded With Love For Brother,https://www.bookthesurprise.com/surprise/box-loaded-with-love-for-brother/,1099.0,5.0,no description,gifts-for-brother,Surprise-Gifts,18783,comment-17807
Mug With Surprise For Bhai,https://www.bookthesurprise.com/surprise/mug-with-surprise-for-bhai/,1099.0,5.0,no description,gifts-for-brother,Surprise-Gifts,18834,comment-17809
All About Bhai – Frame,https://www.bookthesurprise.com/surprise/all-about-bhai-frame/,1299.0,5.0,no description,gifts-for-brother,Surprise-Gifts,18621,comment-17804
Pop For Rakhi-Loaded With Chocolate,https://www.bookthesurprise.com/surprise/pop-for-rakhi-loaded-with-chocolate/,1299.0,5.0,no description,gifts-for-brother,Surprise-Gifts,18776,comment-17808
World’s Best Bhai Hamper,https://www.bookthesurprise.com/surprise/world-s-best-bhai-hamper/,1399.0,5.0,no description,gifts-for-brother,Surprise-Gifts,18805,comment-17802
Surprise Gift Box For Sibling,https://www.bookthesurprise.com/surprise/surprise-gift-box-for-sibling/,2099.0,5.0,no description,gifts-for-brother,Surprise-Gifts,18687,comment-17782
Best Brother Caricature,https://www.bookthesurprise.com/surprise/best-brother-caricature/,2499.0,5.0,no description,gifts-for-brother,Surprise-Gifts,18563,comment-17810
Name A Star For Sibling,https://www.bookthesurprise.com/surprise/name-a-star-for-sibling/,2499.0,5.0,no description,gifts-for-brother,Surprise-Gifts,18681,comment-17783
Sibling Love – Customized App,https://www.bookthesurprise.com/surprise/sibling-love-customized-app/,3999.0,5.0,no description,gifts-for-brother,Surprise-Gifts,18704,comment-17784
Sibling Love Caricature,https://www.bookthesurprise.com/surprise/sibling-love-caricature/,4999.0,5.0,no description,gifts-for-brother,Surprise-Gifts,18890,comment-17786
Comic Friendship Contract,https://www.bookthesurprise.com/surprise/comic-friendship-contract/,299.0,5.0,"The magic happens here because it is here that the recipient will get to see ‘The most stunning, the most beautiful, the loveliest of all being!!’ and then there is the mirror which will make it clear who the message is intended towards – the recipient.",gifts-for-friend,Surprise-Gifts,17192,comment-10226
The Magic Mirror!,https://www.bookthesurprise.com/surprise/the-magic-mirror/,299.0,5.0,"I wanted to bring this many gifts for your birthday!! But, I also wanted you to smile a little while reading this. So, here’s a card with lots and lots of love!!’",gifts-for-friend,Surprise-Gifts,18540,comment-13471
Comical Love Cards,https://www.bookthesurprise.com/surprise/comical-love-cards/,399.0,5.0,"They contain the cutest representation of your thoughts for your partner. So, give them the joy of sweet somethings, which do not need a special occasion to reach the one you love. ",gifts-for-friend,Surprise-Gifts,17375,comment-10368
Jar Of Nothing,https://www.bookthesurprise.com/surprise/jar-of-nothing/,399.0,5.0,"Surprise them with this magnet, which includes a customised picture of them in the middle. Like in real life, the magnet is filled with illustrations that are purely Hyderabad. ",gifts-for-friend,Surprise-Gifts,17396,comment-10370
Photo In a Jar,https://www.bookthesurprise.com/surprise/photo-in-a-jar/,399.0,5.0,Our Marvel superhero fridge magnet has the perfect combination of nerd and romance. ,gifts-for-friend,Surprise-Gifts,17409,comment-10375
Pikachu – I Choose You,https://www.bookthesurprise.com/surprise/pikachu-i-choose-you/,499.0,5.0,Then gift them the ‘you are my soymate’ fridge magnet to make their pun-loving heart happy. ,gifts-for-friend,Surprise-Gifts,17354,comment-10318
Hyderabadi – Kiraak Hyderabadi,https://www.bookthesurprise.com/surprise/hyderabadi-kiraak-hyderabadi/,499.0,5.0,3.54 inches width x 4.5 inches height,gifts-for-friend,Surprise-Gifts,17357,comment-10319
You Are My Marvel – The Marvelous Two,https://www.bookthesurprise.com/surprise/you-are-my-marvel-the-marvelous-two/,499.0,5.0,3.54 inches width x 4.5 inches height,gifts-for-friend,Surprise-Gifts,17359,comment-10321
Dead Cool – Chilling In Love,https://www.bookthesurprise.com/surprise/dead-cool-chilling-in-love/,499.0,5.0,One Coffee Mug,gifts-for-friend,Surprise-Gifts,17362,comment-10322
Berry Much Love,https://www.bookthesurprise.com/surprise/berry-much-love/,499.0,5.0,"In addition to this, you can write customised sweet messages onto these magnets with a mini marker. ",gifts-for-friend,Surprise-Gifts,17364,comment-10323
You Are My Soymate,https://www.bookthesurprise.com/surprise/you-are-my-soymate/,499.0,5.0,"Show your love and appreciation to your loved one on their birthday with this comfortable and soft cushion, which is all about them and for them. It is sure to blow their mind away. ",gifts-for-friend,Surprise-Gifts,17368,comment-10324
Central Perk – I’ll Be There For You,https://www.bookthesurprise.com/surprise/central-perk,499.0,5.0,Gift them this comfortable and warm cushion which is decorated with everything about them. This is sure to make them extremely happy. ,gifts-for-friend,Surprise-Gifts,17369,comment-10325
Kiraak Hyderabadi Friend,https://www.bookthesurprise.com/surprise/kiraak-hyderabadi-friend/,499.0,5.0,Customise this romantic photo book with your favourite pictures of your partner and put them together into the most memorable gift on their birthday. ,gifts-for-friend,Surprise-Gifts,18573,comment-17874
My Cup Of Tea,https://www.bookthesurprise.com/surprise/my-cup-of-tea/,599.0,5.0,"There are 6 Cute Emoji Cards with messages inside them. We are all experts in using emojis to express emotions. Here, the emoji denotes your emotion regarding each message. ",gifts-for-friend,Surprise-Gifts,17259,comment-10297
Cuddle Pillow,https://www.bookthesurprise.com/surprise/cuddle-pillow/,599.0,5.0,The box of Magnet ,gifts-for-friend,Surprise-Gifts,17352,comment-10326
Magnet Mémoire – Moments in Magnets,https://www.bookthesurprise.com/surprise/moments-in-magnets/,799.0,5.0,Mémoire is a set of customisable fridge magnets with 5 photos. We give a duster and a mini-marker so that you can write a message on each magnet!,gifts-for-friend,Surprise-Gifts,17370,comment-10369
Monogram Cushion,https://www.bookthesurprise.com/surprise/monogram-cushion/,999.0,5.0,no description,gifts-for-friend,Surprise-Gifts,17281,comment-10305
All About You – Personalized Cushion,https://www.bookthesurprise.com/surprise/all-about-you-personalized-cushion/,999.0,5.0,no description,gifts-for-friend,Surprise-Gifts,17309,comment-10306
Photo Film Book,https://www.bookthesurprise.com/surprise/photo-film-book/,999.0,5.0,no description,gifts-for-friend,Surprise-Gifts,17507,comment-10403
Your Name in Dictionary,https://www.bookthesurprise.com/surprise/your-name-in-dictionary/,999.0,5.0,no description,gifts-for-friend,Surprise-Gifts,17575,comment-10433
Dedicate A Tree –  Go Green in Love!,https://www.bookthesurprise.com/surprise/dedicate-a-tree-go-green-in-love/,999.0,5.0,no description,gifts-for-friend,Surprise-Gifts,18316,comment-11634
Name in the Frame,https://www.bookthesurprise.com/surprise/name-in-the-frame/,1299.0,5.0,no description,gifts-for-friend,Surprise-Gifts,17240,comment-10282
Picture Yourself,https://www.bookthesurprise.com/surprise/picture-yourself/,1299.0,5.0,no description,gifts-for-friend,Surprise-Gifts,17506,comment-10402
Mosaic Photo Art,https://www.bookthesurprise.com/surprise/mosaic-photo-art/,1499.0,5.0,no description,gifts-for-friend,Surprise-Gifts,17255,comment-10281
Photomosaic – You Are My Precious,https://www.bookthesurprise.com/surprise/photomosaic-you-are-my-precious/,1499.0,5.0,no description,gifts-for-friend,Surprise-Gifts,17764,comment-10601
Name A Star,https://www.bookthesurprise.com/surprise/name-a-star/,2099.0,5.0,no description,gifts-for-friend,Surprise-Gifts,18111,comment-10922
Romantic Love Contract,https://www.bookthesurprise.com/surprise/romantic-love-contract/,299.0,5.0,"The magic happens here because it is here that the recipient will get to see ‘The most stunning, the most beautiful, the loveliest of all being!!’ and then there is the mirror which will make it clear who the message is intended towards – the recipient.",gifts-for-girlfriend,Surprise-Gifts,17186,comment-10225
The Magic Mirror!,https://www.bookthesurprise.com/surprise/the-magic-mirror/,299.0,5.0,"I wanted to bring this many gifts for your birthday!! But, I also wanted you to smile a little while reading this. So, here’s a card with lots and lots of love!!’",gifts-for-girlfriend,Surprise-Gifts,18540,comment-13471
Comical Love Cards,https://www.bookthesurprise.com/surprise/comical-love-cards/,399.0,5.0,"Make their special day even more special and humorous through this thoughtful gift. Whether it is your philosophical friend, or an indecisive loved one, they will surely chuckle at this jar of nothing.",gifts-for-girlfriend,Surprise-Gifts,17375,comment-10368
Jar Of Nothing,https://www.bookthesurprise.com/surprise/jar-of-nothing/,399.0,5.0,"They contain the cutest representation of your thoughts for your partner. So, give them the joy of sweet somethings, which do not need a special occasion to reach the one you love. ",gifts-for-girlfriend,Surprise-Gifts,17396,comment-10370
Photo In a Jar,https://www.bookthesurprise.com/surprise/photo-in-a-jar/,399.0,5.0,"Surprise them with this magnet, which includes a customised picture of them in the middle. Like in real life, the magnet is filled with illustrations that are purely Hyderabad. ",gifts-for-girlfriend,Surprise-Gifts,17409,comment-10375
I Love This Peeling – Let’s Stick Together,https://www.bookthesurprise.com/surprise/i-love-this-peeling,499.0,5.0,"This gift will certainly make your partner chuckle, maybe groan, but mostly happy. ",gifts-for-girlfriend,Surprise-Gifts,17223,comment-10223
My Majes-tea Mug,https://www.bookthesurprise.com/surprise/my-majes-tea-mug/,499.0,5.0,Our Marvel superhero fridge magnet has the perfect combination of nerd and romance. ,gifts-for-girlfriend,Surprise-Gifts,17263,comment-10298
Brew-Tiful Love,https://www.bookthesurprise.com/surprise/brew-tiful-love/,499.0,5.0,"Well, we have the perfect gift for them; The Dead-Cool fridge magnet. ",gifts-for-girlfriend,Surprise-Gifts,17266,comment-10299
Hey Hot-Tea,https://www.bookthesurprise.com/surprise/hey-hot-tea/,499.0,5.0,"Well, you should gift them the Berry Much Love fridge magnet to win over their heart. ",gifts-for-girlfriend,Surprise-Gifts,17268,comment-10301
Pikachu – I Choose You,https://www.bookthesurprise.com/surprise/pikachu-i-choose-you/,499.0,5.0,Then gift them the ‘you are my soymate’ fridge magnet to make their pun-loving heart happy. ,gifts-for-girlfriend,Surprise-Gifts,17354,comment-10318
Hyderabadi – Kiraak Hyderabadi,https://www.bookthesurprise.com/surprise/hyderabadi-kiraak-hyderabadi/,499.0,5.0,"In addition to this, you can write customised sweet messages onto these magnets with a mini marker. ",gifts-for-girlfriend,Surprise-Gifts,17357,comment-10319
All Veg – You Are Always Mine,https://www.bookthesurprise.com/surprise/all-veg-you-are-always-mine/,499.0,5.0,"This sensible and romantic gift is the most apt surprise for your partner’s birthday. The 3 to 4-minute film can also be released on Youtube, with your permission. ",gifts-for-girlfriend,Surprise-Gifts,17358,comment-10320
You Are My Marvel – The Marvelous Two,https://www.bookthesurprise.com/surprise/you-are-my-marvel-the-marvelous-two/,499.0,5.0,This personalised anniversary frame lets your loved one know how enduring your love has been. It creatively displays the time that you have you have been together. ,gifts-for-girlfriend,Surprise-Gifts,17359,comment-10321
Dead Cool – Chilling In Love,https://www.bookthesurprise.com/surprise/dead-cool-chilling-in-love/,499.0,5.0,Customise this romantic photo book with your favourite pictures of your partner and put them together into the most memorable gift on their birthday. ,gifts-for-girlfriend,Surprise-Gifts,17362,comment-10322
Berry Much Love,https://www.bookthesurprise.com/surprise/berry-much-love/,499.0,5.0,"In addition to this, you can pinpoint the location of your tree through the certificate. This gift is a brilliant way to make your partner’s green heart happy. ",gifts-for-girlfriend,Surprise-Gifts,17364,comment-10323
You Are My Soymate,https://www.bookthesurprise.com/surprise/you-are-my-soymate/,499.0,5.0,"This innovative birthday gift comes with a special message that you can dedicate at the beginning of each audio clip. Then, your loved one can listen to their favourite song, melodiously sung for them by strangers. ",gifts-for-girlfriend,Surprise-Gifts,17368,comment-10324
Central Perk – I’ll Be There For You,https://www.bookthesurprise.com/surprise/central-perk,499.0,5.0,"This detailed and artistic photo piece includes everything about you, be it your hobbies, interests and likings. So, what better way is there to celebrate you every single day? ",gifts-for-girlfriend,Surprise-Gifts,17369,comment-10325
My Cup Of Tea,https://www.bookthesurprise.com/surprise/my-cup-of-tea/,599.0,5.0,"Surprise them with a custom app in which they have to play a game, which is all about you. Though this will test how well they know you, the best part is the proposal at the end of the game!",gifts-for-girlfriend,Surprise-Gifts,17259,comment-10297
Cuddle Pillow,https://www.bookthesurprise.com/surprise/cuddle-pillow/,599.0,5.0,"This puzzle is sure to leave them in suspense, and then make them overjoyed with love. ",gifts-for-girlfriend,Surprise-Gifts,17352,comment-10326
A Sweet Love Reward,https://www.bookthesurprise.com/surprise/a-sweet-love-reward/,599.0,5.0,This elaborate game is divided into 3 categories with their own colours. Your partner and you have to perform each task based on the colour. ,gifts-for-girlfriend,Surprise-Gifts,18225,comment-11042
Magnet Mémoire – Moments in Magnets,https://www.bookthesurprise.com/surprise/moments-in-magnets/,799.0,5.0,no description,gifts-for-girlfriend,Surprise-Gifts,17370,comment-10369
Love Journal,https://www.bookthesurprise.com/surprise/love-journal/,799.0,5.0,no description,gifts-for-girlfriend,Surprise-Gifts,17400,comment-10401
Gift A Mini Biopic,https://www.bookthesurprise.com/surprise/gift-a-mini-biopic/,799.0,5.0,no description,gifts-for-girlfriend,Surprise-Gifts,18500,comment-13472
Years of Togetherness,https://www.bookthesurprise.com/surprise/years-of-togetherness/,999.0,5.0,no description,gifts-for-girlfriend,Surprise-Gifts,17249,comment-10278
Love Abstract Cushion,https://www.bookthesurprise.com/surprise/love-abstract-cushion/,999.0,5.0,no description,gifts-for-girlfriend,Surprise-Gifts,17273,comment-10303
Photo Film Book,https://www.bookthesurprise.com/surprise/photo-film-book/,999.0,5.0,no description,gifts-for-girlfriend,Surprise-Gifts,17507,comment-10403
Your Name in Dictionary,https://www.bookthesurprise.com/surprise/your-name-in-dictionary/,999.0,5.0,no description,gifts-for-girlfriend,Surprise-Gifts,17575,comment-10433
Dedicate A Tree –  Go Green in Love!,https://www.bookthesurprise.com/surprise/dedicate-a-tree-go-green-in-love/,999.0,5.0,no description,gifts-for-girlfriend,Surprise-Gifts,18316,comment-11634
Surprise Whatsapp Audio Wishes,https://www.bookthesurprise.com/surprise/surprise-whatsapp-audio-wishes/,1199.0,5.0,no description,gifts-for-girlfriend,Surprise-Gifts,18502,comment-13470
Name in the Frame,https://www.bookthesurprise.com/surprise/name-in-the-frame/,1299.0,5.0,no description,gifts-for-girlfriend,Surprise-Gifts,17240,comment-10282
Picture Yourself,https://www.bookthesurprise.com/surprise/picture-yourself/,1299.0,5.0,no description,gifts-for-girlfriend,Surprise-Gifts,17506,comment-10402
Love Proposal Through App,https://www.bookthesurprise.com/surprise/love-proposal-through-app/,1299.0,5.0,no description,gifts-for-girlfriend,Surprise-Gifts,18504,comment-13480
Open When Letters,https://www.bookthesurprise.com/surprise/open-when-letters/,1499.0,5.0,no description,gifts-for-girlfriend,Surprise-Gifts,17184,comment-10227
Mosaic Photo Art,https://www.bookthesurprise.com/surprise/mosaic-photo-art/,1499.0,5.0,no description,gifts-for-girlfriend,Surprise-Gifts,17255,comment-10281
Photomosaic – You Are My Precious,https://www.bookthesurprise.com/surprise/photomosaic-you-are-my-precious/,1499.0,5.0,no description,gifts-for-girlfriend,Surprise-Gifts,17764,comment-10601
Momentous Milestones,https://www.bookthesurprise.com/surprise/momentous-milestones/,1699.0,5.0,no description,gifts-for-girlfriend,Surprise-Gifts,17229,comment-10274
Name A Star,https://www.bookthesurprise.com/surprise/name-a-star/,2099.0,5.0,no description,gifts-for-girlfriend,Surprise-Gifts,18111,comment-10922
Jigsaw Puzzle Surprise!,https://www.bookthesurprise.com/surprise/jigsaw-puzzle-surprise/,2699.0,5.0,no description,gifts-for-girlfriend,Surprise-Gifts,18516,comment-13481
Open When You Feel,https://www.bookthesurprise.com/surprise/open-when-you-feel/,3199.0,5.0,no description,gifts-for-girlfriend,Surprise-Gifts,18509,comment-13477
Spin The Wheel of Fantasies,https://www.bookthesurprise.com/surprise/spin-the-wheel-of-fantasies/,3990.0,5.0,no description,gifts-for-girlfriend,Surprise-Gifts,18522,comment-13475
The Magic Mirror!,https://www.bookthesurprise.com/surprise/the-magic-mirror/,299.0,5.0,The Magic Mirror!,gifts-for-her,Surprise-Gifts,18540,comment-13471
Comical Love Cards,https://www.bookthesurprise.com/surprise/comical-love-cards/,399.0,5.0,Comical Love Cards,gifts-for-her,Surprise-Gifts,17375,comment-10368
Jar Of Nothing,https://www.bookthesurprise.com/surprise/jar-of-nothing/,399.0,5.0,Jar Of Nothing,gifts-for-her,Surprise-Gifts,17396,comment-10370
My Majes-tea Mug,https://www.bookthesurprise.com/surprise/my-majes-tea-mug/,499.0,5.0,"To the king/queen of your heart, present this exclusive majes-tea mug and let them surrender themselves in your love. Also let them know that they rule your heart with all the sweet little things that they do for you. Treat your love like a true Royalty with this beautiful and unique coffee mug.",gifts-for-her,Surprise-Gifts,17263,comment-10298
Brew-Tiful Love,https://www.bookthesurprise.com/surprise/brew-tiful-love/,499.0,5.0,Get love brewing with this brew-tiful love mug. Make your partner smile as they receive these unique coffee mugs as a token of love from you. These mugs will make their coffee time even more happy and loveable as they sip through their favorite beverage from your romantic gift for them.,gifts-for-her,Surprise-Gifts,17266,comment-10299
Hey Hot-Tea,https://www.bookthesurprise.com/surprise/hey-hot-tea/,499.0,5.0,"Let your romantic partner know that he/she is the hottest being alive on earth with this Hot-tea (hottie) mug. Express your love in a cheesy, yet romantic manner that will surely bring a beautiful smile to their faces. Let them unwrap this romantic personalized coffee mug to realise how hot they are!",gifts-for-her,Surprise-Gifts,17268,comment-10301
Pikachu – I Choose You,https://www.bookthesurprise.com/surprise/pikachu-i-choose-you/,499.0,5.0,Pikachu – I Choose You,gifts-for-her,Surprise-Gifts,17354,comment-10318
Hyderabadi – Kiraak Hyderabadi,https://www.bookthesurprise.com/surprise/hyderabadi-kiraak-hyderabadi/,499.0,5.0,Kiraak Hyderabadi – Custom fridge magnet,gifts-for-her,Surprise-Gifts,17357,comment-10319
You Are My Marvel – The Marvelous Two,https://www.bookthesurprise.com/surprise/you-are-my-marvel-the-marvelous-two/,499.0,5.0,You Are My Marvel – The Marvelous Two,gifts-for-her,Surprise-Gifts,17359,comment-10321
Dead Cool – Chilling In Love,https://www.bookthesurprise.com/surprise/dead-cool-chilling-in-love/,499.0,5.0,Dead Cool – Chilling In Love,gifts-for-her,Surprise-Gifts,17362,comment-10322
Berry Much Love,https://www.bookthesurprise.com/surprise/berry-much-love/,499.0,5.0,Berry Much Love,gifts-for-her,Surprise-Gifts,17364,comment-10323
You Are My Soymate,https://www.bookthesurprise.com/surprise/you-are-my-soymate/,499.0,5.0,You Are My Soymate,gifts-for-her,Surprise-Gifts,17368,comment-10324
Central Perk – I’ll Be There For You,https://www.bookthesurprise.com/surprise/central-perk,499.0,5.0,"Make your bond of friendship even more strong with this amazing FRIENDS themed custom fridge magnets. Tell your BFF that no matter who comes and goes in your life, their place in your heart is irreplaceable and that they are the constants in your life.",gifts-for-her,Surprise-Gifts,17369,comment-10325
My Cup Of Tea,https://www.bookthesurprise.com/surprise/my-cup-of-tea/,599.0,5.0,Show off your perfect love story and let your partner know that you feel like the luckiest person to be in love with them. Present this uniquely personalized mug to them and express that he/she is just your perfect cup of tea who fills your life with lots of love and positivity.,gifts-for-her,Surprise-Gifts,17259,comment-10297
Cuddle Pillow,https://www.bookthesurprise.com/surprise/cuddle-pillow/,599.0,5.0,Cuddle Pillow,gifts-for-her,Surprise-Gifts,17352,comment-10326
Magnet Mémoire – Moments in Magnets,https://www.bookthesurprise.com/surprise/moments-in-magnets/,799.0,5.0,Magnet Mémoire – Moments in Magnets,gifts-for-her,Surprise-Gifts,17370,comment-10369
Love Journal,https://www.bookthesurprise.com/surprise/love-journal/,799.0,5.0,"Who would not like to have letters of love, exactly in old school fashion from the one they truly love? This Valentine Season, BookTheSurprise brings to your a ‘Love Journal’, a unique personalized online gift idea that brings in a classic illustration of your undying love for your partner. This illustration is a combination of different kinds of love letters written in different styles, like Bollywood, funny, retro, etc.. All of these letters when presented to the one you love will melt their heart and make them feel truly loved and special. It is so rightly said that love letters are something that will never go out of fashion. Give the love of your life this special Valentine gift and leave them super impressed. Enjoy reading out those letters to your partner personally and make this Valentine’s Day all the more memorable for them.",gifts-for-her,Surprise-Gifts,17400,comment-10401
Gift A Mini Biopic,https://www.bookthesurprise.com/surprise/gift-a-mini-biopic/,799.0,5.0,Gift A Mini Biopic,gifts-for-her,Surprise-Gifts,18500,comment-13472
Years of Togetherness,https://www.bookthesurprise.com/surprise/years-of-togetherness/,999.0,5.0,Years of Togetherness,gifts-for-her,Surprise-Gifts,17249,comment-10278
Love Abstract Cushion,https://www.bookthesurprise.com/surprise/love-abstract-cushion/,999.0,5.0,"A love filled cushion that makes your dear one realize that their love means the world to you. Present this soft and fluffy cushion of love to your favorite people and let them know that they are special. Made from the highest quality fabric, this cushion will surely remind them of you and bring them a sweet smile.",gifts-for-her,Surprise-Gifts,17273,comment-10303
Photo Film Book,https://www.bookthesurprise.com/surprise/photo-film-book/,999.0,5.0,Photo Film Book,gifts-for-her,Surprise-Gifts,17507,comment-10403
