product_name,product_link,product_price(₹),product_ratings(out of 5),product_description,sub-category,Category,product_ids,comment_ids
3D Butterfly Wooden Lamp,https://www.bookthesurprise.com/surprise/3d-butterfly-wooden-lamp/,2199.0,5.0,Luminous Butterfly Lamp – Let The Light of Happiness Flutter Inside The Room! ,3d-lamps,Surprise-Gifts,17311,comment-10376
Lovers Lamp,https://www.bookthesurprise.com/surprise/lovers-lamp/,2199.0,5.0,A 3D lamp that portrays two lovers deeply in love just like you and your partner,3d-lamps,Surprise-Gifts,17314,comment-10388
I Love You Lamp,https://www.bookthesurprise.com/surprise/i-love-you-lamp/,2199.0,5.0,This cute 3D lamp has “I love you” written on it in a beautiful manner for you and your loved one,3d-lamps,Surprise-Gifts,17318,comment-10387
Stars & Moon Lamp,https://www.bookthesurprise.com/surprise/stars-moon-lamp/,2199.0,5.0,3D lamp with stars and moon design is an amazing gift to give your loved one.,3d-lamps,Surprise-Gifts,17321,comment-10400
Guitar Lamp,https://www.bookthesurprise.com/surprise/guitar-lamp/,2199.0,5.0,"Know someone who loves music, then this 3D lamp with guitar design is perfect for them",3d-lamps,Surprise-Gifts,17325,comment-10399
Lulfu Lamp,https://www.bookthesurprise.com/surprise/lulfu-lamp/,2199.0,5.0,3D lamp with music notes on it for friends and family who are passionate about music,3d-lamps,Surprise-Gifts,17329,comment-10398
Saxophone Lamp,https://www.bookthesurprise.com/surprise/saxophone-lamp/,2199.0,5.0,3D lamp with a saxophone design for loved ones who love listening to music,3d-lamps,Surprise-Gifts,17333,comment-10397
Snowyman Lamp,https://www.bookthesurprise.com/surprise/snowyman-lamp/,2199.0,5.0,This beautiful 3D lamp with a snowman design is a perfect gift for christmas or any occasion,3d-lamps,Surprise-Gifts,17336,comment-10396
Heart Lamp,https://www.bookthesurprise.com/surprise/heart-lamp/,2199.0,5.0,A very romantic 3D lamp with many hearts displayed on it in a beautiful manner,3d-lamps,Surprise-Gifts,17340,comment-10395
Glow Of Love – 3D Lamp,https://www.bookthesurprise.com/surprise/glow-of-love-3d-lamp/,2499.0,5.0,3D illusion lamp that displays a heart in a quirky way is an amazing gift for your loved one,3d-lamps,Surprise-Gifts,17442,comment-10382
Radiate Love – 3D Lamp,https://www.bookthesurprise.com/surprise/radiate-love-3d-lamp/,2499.0,5.0,"3D lamp with the very romantic design, filled with hearts and the word “love” displayed in a beautiful way",3d-lamps,Surprise-Gifts,17450,comment-10392
Flames Of Love – 3D Lamp,https://www.bookthesurprise.com/surprise/flames-of-love-3d-lamp/,2499.0,5.0,This 3D lamp has a very unique design with the words “I Love You” written in a very romantic way,3d-lamps,Surprise-Gifts,17457,comment-10383
Radiant Romance – 3D Lamp,https://www.bookthesurprise.com/surprise/radiant-romance-3d-lamp/,2499.0,5.0,"A romantic 3D lamp displaying a cute couple in a moonlit, starry night is perfect for the two of you",3d-lamps,Surprise-Gifts,17464,comment-10393
Gleaming Couple – 3D Lamp,https://www.bookthesurprise.com/surprise/gleaming-couple-3d-lamp/,2499.0,5.0,This 3D lamp is the cutest design that your dear one will love a lot,3d-lamps,Surprise-Gifts,17470,comment-10381
Emoji Glow – 3D Lamp,https://www.bookthesurprise.com/surprise/emoji-glow-3d-lamp/,2499.0,5.0,A cute 3D lamp with an emoji design that will bring a smile on anyone’s face,3d-lamps,Surprise-Gifts,17477,comment-10380
Raving Hearts – 3D Lamp,https://www.bookthesurprise.com/surprise/raving-hearts-3d-lamp/,2499.0,5.0,This 3D lamp filled with hearts is a good way of expressing your love,3d-lamps,Surprise-Gifts,17483,comment-10391
Love Struck – 3D Lamp,https://www.bookthesurprise.com/surprise/love-struck-3d-lamp/,2499.0,5.0,Heart shaped 3D lamp that will leave your partner love struck for sure,3d-lamps,Surprise-Gifts,17491,comment-10390
To Mom & Dad With Love!,https://www.bookthesurprise.com/surprise/to-mom-dad-with-love/,2499.0,5.0,Show your love to your parents with this “I love you mom and dad” 3D lamp,3d-lamps,Surprise-Gifts,17499,comment-10389
The Magic Mirror!,https://www.bookthesurprise.com/surprise/the-magic-mirror/,299.0,5.0,"The magic happens here because it is here that the recipient will get to see ‘The most stunning, the most beautiful, the loveliest of all being!!’ and then there is the mirror which will make it clear who the message is intended towards – the recipient.",anniversary-gifts,Surprise-Gifts,18540,comment-13471
Comical Love Cards,https://www.bookthesurprise.com/surprise/comical-love-cards/,399.0,5.0,"Make their special day even more special and humorous through this thoughtful gift. Whether it is your philosophical friend, or an indecisive loved one, they will surely chuckle at this jar of nothing.",anniversary-gifts,Surprise-Gifts,17375,comment-10368
Jar Of Nothing,https://www.bookthesurprise.com/surprise/jar-of-nothing/,399.0,5.0,"They contain the cutest representation of your thoughts for your partner. So, give them the joy of sweet somethings, which do not need a special occasion to reach the one you love. ",anniversary-gifts,Surprise-Gifts,17396,comment-10370
Photo In a Jar,https://www.bookthesurprise.com/surprise/photo-in-a-jar/,399.0,5.0,"Surprise them with this magnet, which includes a customised picture of them in the middle. Like in real life, the magnet is filled with illustrations that are purely Hyderabad. ",anniversary-gifts,Surprise-Gifts,17409,comment-10375
Pikachu – I Choose You,https://www.bookthesurprise.com/surprise/pikachu-i-choose-you/,499.0,5.0,"This gift will certainly make your partner chuckle, maybe groan, but mostly happy. ",anniversary-gifts,Surprise-Gifts,17354,comment-10318
Hyderabadi – Kiraak Hyderabadi,https://www.bookthesurprise.com/surprise/hyderabadi-kiraak-hyderabadi/,499.0,5.0,Our Marvel superhero fridge magnet has the perfect combination of nerd and romance. ,anniversary-gifts,Surprise-Gifts,17357,comment-10319
All Veg – You Are Always Mine,https://www.bookthesurprise.com/surprise/all-veg-you-are-always-mine/,499.0,5.0,"Well, we have the perfect gift for them; The Dead-Cool fridge magnet. ",anniversary-gifts,Surprise-Gifts,17358,comment-10320
You Are My Marvel – The Marvelous Two,https://www.bookthesurprise.com/surprise/you-are-my-marvel-the-marvelous-two/,499.0,5.0,"Well, you should gift them the Berry Much Love fridge magnet to win over their heart. ",anniversary-gifts,Surprise-Gifts,17359,comment-10321
Dead Cool – Chilling In Love,https://www.bookthesurprise.com/surprise/dead-cool-chilling-in-love/,499.0,5.0,Then gift them the ‘you are my soymate’ fridge magnet to make their pun-loving heart happy. ,anniversary-gifts,Surprise-Gifts,17362,comment-10322
Berry Much Love,https://www.bookthesurprise.com/surprise/berry-much-love/,499.0,5.0,"This sensible and romantic gift is the most apt surprise for your partner’s birthday. The 3 to 4-minute film can also be released on Youtube, with your permission. ",anniversary-gifts,Surprise-Gifts,17364,comment-10323
You Are My Soymate,https://www.bookthesurprise.com/surprise/you-are-my-soymate/,499.0,5.0,This personalised anniversary frame lets your loved one know how enduring your love has been. It creatively displays the time that you have you have been together. ,anniversary-gifts,Surprise-Gifts,17368,comment-10324
Cuddle Pillow,https://www.bookthesurprise.com/surprise/cuddle-pillow/,599.0,5.0,"Show your love and appreciation to your loved one on their birthday with this comfortable and soft cushion, which is all about them and for them. It is sure to blow their mind away. ",anniversary-gifts,Surprise-Gifts,17352,comment-10326
Gift A Mini Biopic,https://www.bookthesurprise.com/surprise/gift-a-mini-biopic/,799.0,5.0,Gift them this comfortable and warm cushion which is decorated with everything about them. This is sure to make them extremely happy. ,anniversary-gifts,Surprise-Gifts,18500,comment-13472
Years of Togetherness,https://www.bookthesurprise.com/surprise/years-of-togetherness/,999.0,5.0,Customise this romantic photo book with your favourite pictures of your partner and put them together into the most memorable gift on their birthday. ,anniversary-gifts,Surprise-Gifts,17249,comment-10278
Monogram Cushion,https://www.bookthesurprise.com/surprise/monogram-cushion/,999.0,5.0,"In addition to this, you can pinpoint the location of your tree through the certificate. This gift is a brilliant way to make your partner’s green heart happy. ",anniversary-gifts,Surprise-Gifts,17281,comment-10305
All About You – Personalized Cushion,https://www.bookthesurprise.com/surprise/all-about-you-personalized-cushion/,999.0,5.0,"This innovative birthday gift comes with a special message that you can dedicate at the beginning of each audio clip. Then, your loved one can listen to their favourite song, melodiously sung for them by strangers. ",anniversary-gifts,Surprise-Gifts,17309,comment-10306
Photo Film Book,https://www.bookthesurprise.com/surprise/photo-film-book/,999.0,5.0,"This detailed and artistic photo piece includes everything about you, be it your hobbies, interests and likings. So, what better way is there to celebrate you every single day? ",anniversary-gifts,Surprise-Gifts,17507,comment-10403
Dedicate A Tree –  Go Green in Love!,https://www.bookthesurprise.com/surprise/dedicate-a-tree-go-green-in-love/,999.0,5.0,"Surprise them with a custom app in which they have to play a game, which is all about you. Though this will test how well they know you, the best part is the proposal at the end of the game!",anniversary-gifts,Surprise-Gifts,18316,comment-11634
Surprise Whatsapp Audio Wishes,https://www.bookthesurprise.com/surprise/surprise-whatsapp-audio-wishes/,1199.0,5.0,"It also includes a certificate to announce to your partner that they are, in fact, the best. The gift set includes two rustic polaroids, a sticker and an adorable heart-shaped pillow for eternal hugs and cuddles. ",anniversary-gifts,Surprise-Gifts,18502,comment-13470
Picture Yourself,https://www.bookthesurprise.com/surprise/picture-yourself/,1299.0,5.0, 10 photos of you and your loved one,anniversary-gifts,Surprise-Gifts,17506,comment-10402
Love Proposal Through App,https://www.bookthesurprise.com/surprise/love-proposal-through-app/,1299.0,5.0,"If that is not enough, give them innovative QR code wishes for their special virtual messages to express your love creatively.",anniversary-gifts,Surprise-Gifts,18504,comment-13480
The Love Grill,https://www.bookthesurprise.com/surprise/the-love-grill/,1499.0,5.0,This elaborate game is divided into 3 categories with their own colours. Your partner and you have to perform each task based on the colour. ,anniversary-gifts,Surprise-Gifts,17513,comment-10404
Momentous Milestones,https://www.bookthesurprise.com/surprise/momentous-milestones/,1699.0,5.0,"The set of gifts includes a personalized photo frame, which you can fill up with details about your partner, along with a cute picture. Then, receive two special polaroids of your partner, which are vintage and aesthetically pleasing. ",anniversary-gifts,Surprise-Gifts,17229,comment-10274
Couple Personalized Pillow Set,https://www.bookthesurprise.com/surprise/couple-personalized-pillow-set/,1799.0,5.0,no description,anniversary-gifts,Surprise-Gifts,17277,comment-10304
Jigsaw Puzzle Surprise!,https://www.bookthesurprise.com/surprise/jigsaw-puzzle-surprise/,2599.0,5.0,no description,anniversary-gifts,Surprise-Gifts,18516,comment-13481
Open When You Feel,https://www.bookthesurprise.com/surprise/open-when-you-feel/,2699.0,5.0,no description,anniversary-gifts,Surprise-Gifts,18509,comment-13477
Spin The Wheel of Fantasies,https://www.bookthesurprise.com/surprise/spin-the-wheel-of-fantasies/,3999.0,5.0,no description,anniversary-gifts,Surprise-Gifts,18522,comment-13475
Gold Anniversary Surprise,https://www.bookthesurprise.com/gold-anniversary-surprise/,5900.0,5.0,"An Anniversary Surprise With Celebratory Elements, Sweet Treats, Memories, Lovely Presents & Paparazzi!",anniversary-surprises,Surprise-Gifts,4614,comment-9871
Platinum Anniversary Surprise,https://www.bookthesurprise.com/platinum-anniversary-surprise/,6900.0,5.0,"An Anniversary Surprise With Celebratory Elements, Sweet Treats, Memories, Special Card Wishes, Lovely Presents, & Paparazzi!",anniversary-surprises,Surprise-Gifts,4680,comment-9862
Rhodium Anniversary Surprise,https://www.bookthesurprise.com/rhodium-anniversary-surprise/,7900.0,5.0,"An Anniversary Surprise With Celebratory Elements, Sweet Treats, Memories, Special Card Wishes, Audio Wishes, Lovely Presents, & Paparazzi!",anniversary-surprises,Surprise-Gifts,4647,comment-10522
Helium 3 Anniversary Surprise,https://www.bookthesurprise.com/helium-3-anniversary-surprise/,8900.0,5.0,"An Anniversary Surprise With Celebratory Elements, Sweet Treats, Memories, Special Card Wishes, Star Dedications, Lovely Presents, & Paparazzi!",anniversary-surprises,Surprise-Gifts,4721,comment-10526
Red Beryl Anniversary Surprise,https://www.bookthesurprise.com/red-beryl-anniversary-surprise/,9900.0,5.0,"An Anniversary Surprise With Celebratory Elements, Sweet Treats, Memories, Special Card Wishes, Music and Madness, Special Dedications, Balloon Surprise Box, Lovely Presents, & Paparazzi! ",anniversary-surprises,Surprise-Gifts,4778,comment-10525
Plutonium Anniversary Surprise,https://www.bookthesurprise.com/plutonium-anniversary-surprise/,11900.0,5.0,"An Anniversary Surprise With Celebratory Elements, Sweet Treats, Memories, Special Card Wishes, Music and Madness, Special Dedications, Balloon Surprise Box, Special Love Coupons, Pencil Art Frame, Lovely Presents, & Paparazzi! ",anniversary-surprises,Surprise-Gifts,16561,comment-10527
Painite Anniversary Surprise,https://www.bookthesurprise.com/painite-anniversary-surprise/,13900.0,5.0,"An Anniversary Surprise With Celebratory Elements, Sweet Treats, Memories, Special Card Wishes, Music and Madness, Special Dedications, Love Coupons, Love Hamper, Balloon Surprise Box, Lovely Presents, & Paparazzi! ",anniversary-surprises,Surprise-Gifts,4835,comment-10528
Taaffeite Anniversary Surprise,https://www.bookthesurprise.com/taaffeite-anniversary-surprise/,15900.0,5.0,"An Anniversary Surprise With Celebratory Elements, Sweet Treats, Memories, Special Card Wishes, Live Performance by Guitarist, Special Dedications, Love Coupons, Balloon Surprise Box, Love Contract, Lovely Presents, & Paparazzi! ",anniversary-surprises,Surprise-Gifts,16771,comment-10529
Tritium Anniversary Surprise,https://www.bookthesurprise.com/tritium-anniversary-surprise/,20900.0,5.0,"An Anniversary Surprise With Celebratory Elements, Sweet Treats, Memories, Special Card Wishes, Live Performance by Guitarist, Special Video Dedications, Tree Dedications, Love Coupons, Balloon Surprise Box, Love Contract, Lovely Presents, & Paparazzi! ",anniversary-surprises,Surprise-Gifts,16837,comment-10530
Diamond Anniversary Surprise,https://www.bookthesurprise.com/diamond-anniversary-surprise/,25900.0,5.0,"An Anniversary Surprise With Celebratory Elements, Sweet Treats, Memories, Special Card Wishes, Live Performance by Guitarist, Wishes on Big Screen, Love Hamper, Star Dedications, A Lightning Night Sky, Love Coupons, Balloon Surprise Box, Love Contract, Lovely Presents, & Paparazzi! ",anniversary-surprises,Surprise-Gifts,16903,comment-10532
Californium Anniversary Surprise,https://www.bookthesurprise.com/californium-anniversary-surprise/,30900.0,5.0,"An Anniversary Surprise With Celebratory Elements, Sweet Treats, Memories, Special Card Wishes, Live Performance by Guitarist, Wishes on Big Screen, A Lightning Night Sky, Love Coupons, Balloon Surprise Box, Love Contract, Lovely Presents, & Paparazzi!",anniversary-surprises,Surprise-Gifts,16969,comment-10531
Antimatter Anniversary Surprise,https://www.bookthesurprise.com/antimatter-anniversary-surprise/,49900.0,5.0,"An Anniversary Surprise With Celebratory Elements, Sweet Treats, Memories, Special Card Wishes, Live Performance by Guitarist, Wishes on Big Screen, A Lightning Night Sky, Helping Hands, Love Coupons, Balloon Surprise Box, Love Contract, Lovely Presents, & Paparazzi!",anniversary-surprises,Surprise-Gifts,17035,comment-10533
The Magic Mirror!,https://www.bookthesurprise.com/surprise/the-magic-mirror/,299.0,5.0,"I wanted to bring this many gifts for your birthday!! But, I also wanted you to smile a little while reading this. So, here’s a card with lots and lots of love!!’",birthday-gifts,Surprise-Gifts,18540,comment-13471
Comical Love Cards,https://www.bookthesurprise.com/surprise/comical-love-cards/,399.0,5.0,"They contain the cutest representation of your thoughts for your partner. So, give them the joy of sweet somethings, which do not need a special occasion to reach the one you love. ",birthday-gifts,Surprise-Gifts,17375,comment-10368
Jar Of Nothing,https://www.bookthesurprise.com/surprise/jar-of-nothing/,399.0,5.0,"Surprise them with this magnet, which includes a customised picture of them in the middle. Like in real life, the magnet is filled with illustrations that are purely Hyderabad. ",birthday-gifts,Surprise-Gifts,17396,comment-10370
Photo In a Jar,https://www.bookthesurprise.com/surprise/photo-in-a-jar/,399.0,5.0,"What better way is there to express your love for them, than a food pun? This fridge magnet can be personalised with a sweet picture of you and your partner, surrounded by illustrations of yummy food items. ",birthday-gifts,Surprise-Gifts,17409,comment-10375
Pikachu – I Choose You,https://www.bookthesurprise.com/surprise/pikachu-i-choose-you/,499.0,5.0,"Well, we have the perfect gift for them; The Dead-Cool fridge magnet. ",birthday-gifts,Surprise-Gifts,17354,comment-10318
Hyderabadi – Kiraak Hyderabadi,https://www.bookthesurprise.com/surprise/hyderabadi-kiraak-hyderabadi/,499.0,5.0,"Well, you should gift them the Berry Much Love fridge magnet to win over their heart. ",birthday-gifts,Surprise-Gifts,17357,comment-10319
All Veg – You Are Always Mine,https://www.bookthesurprise.com/surprise/all-veg-you-are-always-mine/,499.0,5.0,Then gift them the ‘you are my soymate’ fridge magnet to make their pun-loving heart happy. ,birthday-gifts,Surprise-Gifts,17358,comment-10320
You Are My Marvel – The Marvelous Two,https://www.bookthesurprise.com/surprise/you-are-my-marvel-the-marvelous-two/,499.0,5.0,"Well, the best father’s day gift has to be the “my superhero” fridge magnet. ",birthday-gifts,Surprise-Gifts,17359,comment-10321
Dead Cool – Chilling In Love,https://www.bookthesurprise.com/surprise/dead-cool-chilling-in-love/,499.0,5.0,Through the “All About Me” coffee mug for certain. ,birthday-gifts,Surprise-Gifts,17362,comment-10322
Berry Much Love,https://www.bookthesurprise.com/surprise/berry-much-love/,499.0,5.0,This fridge magnet can be customised with a picture of your loved one. It includes cute illustrations that are sure to make the special person smile. ,birthday-gifts,Surprise-Gifts,17364,comment-10323
You Are My Soymate,https://www.bookthesurprise.com/surprise/you-are-my-soymate/,499.0,5.0,An HBD coffee mug of course! ,birthday-gifts,Surprise-Gifts,17368,comment-10324
My Superhero – Fridge Magnet,https://www.bookthesurprise.com/surprise/my-superhero-fridge-magnet/,499.0,5.0,We think that a groovy custom name mug would be perfect for them! ,birthday-gifts,Surprise-Gifts,18539,comment-13474
Cuddle Pillow,https://www.bookthesurprise.com/surprise/cuddle-pillow/,599.0,5.0,"In addition to this, you can pinpoint the location of your tree through the certificate. This gift is a brilliant way to make your partner’s green heart happy. ",birthday-gifts,Surprise-Gifts,17352,comment-10326
Gift A Mini Biopic,https://www.bookthesurprise.com/surprise/gift-a-mini-biopic/,799.0,5.0,"You can also make use of technology in expressing your love, through a set of 5 QR code birthday wishes. Just let your loved one scan the codes, and be surprised by the virtual birthday wish. ",birthday-gifts,Surprise-Gifts,18500,comment-13472
Monogram Cushion,https://www.bookthesurprise.com/surprise/monogram-cushion/,999.0,5.0,"This innovative birthday gift comes with a special message that you can dedicate at the beginning of each audio clip. Then, your loved one can listen to their favourite song, melodiously sung for them by strangers. ",birthday-gifts,Surprise-Gifts,17281,comment-10305
All About You – Personalized Cushion,https://www.bookthesurprise.com/surprise/all-about-you-personalized-cushion/,999.0,5.0,"This detailed and artistic photo piece includes everything about you, be it your hobbies, interests and likings. So, what better way is there to celebrate you every single day? ",birthday-gifts,Surprise-Gifts,17309,comment-10306
Photo Film Book,https://www.bookthesurprise.com/surprise/photo-film-book/,999.0,5.0,"Surprise them with a custom app in which they have to play a game, which is all about you. Though this will test how well they know you, the best part is the proposal at the end of the game!",birthday-gifts,Surprise-Gifts,17507,comment-10403
Dedicate A Tree –  Go Green in Love!,https://www.bookthesurprise.com/surprise/dedicate-a-tree-go-green-in-love/,999.0,5.0,A4 sized frame,birthday-gifts,Surprise-Gifts,18316,comment-11634
Surprise Whatsapp Audio Wishes,https://www.bookthesurprise.com/surprise/surprise-whatsapp-audio-wishes/,999.0,5.0,"Get your partner’s classifieds frame customised with a picture of them on the front page. Then, watch them become the headlines with articles dedicated just for them. ",birthday-gifts,Surprise-Gifts,18502,comment-13470
Picture Yourself,https://www.bookthesurprise.com/surprise/picture-yourself/,1199.0,5.0,"This puzzle is sure to leave them in suspense, and then make them overjoyed with love. ",birthday-gifts,Surprise-Gifts,17506,comment-10402
Love Proposal Through App,https://www.bookthesurprise.com/surprise/love-proposal-through-app/,1299.0,5.0,"If that is not enough, give them innovative QR code wishes for their special virtual messages to express your love creatively.",birthday-gifts,Surprise-Gifts,18504,comment-13480
The Love Grill,https://www.bookthesurprise.com/surprise/the-love-grill/,1399.0,5.0,no description,birthday-gifts,Surprise-Gifts,17513,comment-10404
Jigsaw Puzzle Surprise!,https://www.bookthesurprise.com/surprise/jigsaw-puzzle-surprise/,1499.0,5.0,no description,birthday-gifts,Surprise-Gifts,18516,comment-13481
Open When You Feel,https://www.bookthesurprise.com/surprise/open-when-you-feel/,2699.0,5.0,no description,birthday-gifts,Surprise-Gifts,18509,comment-13477
Spin The Wheel of Fantasies,https://www.bookthesurprise.com/surprise/spin-the-wheel-of-fantasies/,3999.0,5.0,no description,birthday-gifts,Surprise-Gifts,18522,comment-13475
Silver Birthday Surprise,https://www.bookthesurprise.com/silver-birthday-surprise/,4900.0,5.0,Add the sweets and colours to your Most special person’s Birthday with the Silver Birthday surprise Box delivered right at our doorstep.,birthday-surprises,Party-Surprises,34196,comment-38852
Germanium Birthday Surprise,https://www.bookthesurprise.com/germanium-birthday-surprise/,5900.0,5.0,"The Germanium Birthday Decorations has the right proportions of sweets,aroma and gift bundles to add on. Your beloved Birthday person will deeply surprised by the  festive mood it brings in",birthday-surprises,Party-Surprises,15964,comment-9779
Ruthenium Birthday Surprise,https://www.bookthesurprise.com/ruthenium-birthday-surprise/,7900.0,5.0,Bring in the home some awesomeness and ornate the surroundings with the festive mood. the Ruthenium will fuel the celebrations to another level. ,birthday-surprises,Party-Surprises,18942,comment-17194
Osmium Birthday Surprise,https://www.bookthesurprise.com/osmium-birthday-surprise/,9900.0,5.0,"A birthday Surprise with ample sweet delights, some fancy customized gifts and loads of treats  and witness a Momentous Birthday celebration.",birthday-surprises,Party-Surprises,18984,comment-17195
Iridium Birthday Surprise,https://www.bookthesurprise.com/iridium-birthday-surprise/,13900.0,5.0,Make way for The Iridium Birthday Surprise as its gonna be a one of a kind Birthday surprise which they wouldn’t have witnessed in a long time. The tons of goodies and gifts are sure to melt their hearts.,birthday-surprises,Party-Surprises,34194,comment-38888
Blow Me – Birthday Surprise,https://www.bookthesurprise.com/blow-me-birthday-surprise/,1099.0,5.0,A box with a balloon inside that your loved one should pop to receive an birthday note,blow-me-exciting-balloon-wish-cards,Balloon-Surprises,17702,comment-10560
Blow Me – Say Miss You,https://www.bookthesurprise.com/surprise/blow-me-say-miss-you/,1099.0,5.0,A box with a balloon inside that your loved one should pop to receive a miss you note,blow-me-exciting-balloon-wish-cards,Balloon-Surprises,17707,comment-10561
Blow Me – I love You Gift,https://www.bookthesurprise.com/blow-me-i-love-you-gift/,1099.0,5.0,A box with a balloon inside that your loved one should pop to receive a I love you note,blow-me-exciting-balloon-wish-cards,Balloon-Surprises,17712,comment-10562
Blow Me – Send Congratulations,https://www.bookthesurprise.com/surprise/blow-me-send-congratulations/,1099.0,5.0,A box with a balloon inside that your loved one should pop to receive a congratulations note,blow-me-exciting-balloon-wish-cards,Balloon-Surprises,17717,comment-10563
Blow Me – Say Get Well Soon,https://www.bookthesurprise.com/blow-me-say-get-well-soon/,1099.0,5.0,A box with a balloon inside that your loved one should pop to receive a apology note,blow-me-exciting-balloon-wish-cards,Balloon-Surprises,17722,comment-10564
Exceptional Conservative Dining at MG Road,https://www.bookthesurprise.com/surprise/dinner-at-mg-road/,2849.0,5.0,"3 course meal( starter, main and dessert)",candle-light-dinner-in-bangalore,Premium-Surprises,22172,comment-17336
