product_name,product_link,product_price(₹),product_ratings(out of 5),product_description,sub-category,Category,product_ids,comment_ids
A Surprise Shooting Game,https://www.bookthesurprise.com/surprise/a-surprise-shooting-game/,1999.0,5.0,no description,experiences,Party-Surprises,34109,comment-10968
Escape Room,https://www.bookthesurprise.com/surprise/escape-room/,2499.0,5.0,no description,experiences,Party-Surprises,33706,comment-10970
Horse-Trekking,https://www.bookthesurprise.com/surprise/horse-trekking/,2999.0,5.0,no description,experiences,Party-Surprises,18276,comment-10754
Surprise In A Cake,https://www.bookthesurprise.com/surprise/surprise-in-a-cake/,2999.0,5.0,no description,experiences,Party-Surprises,34095,comment-11247
Taste The Darkness(The Secret Supper),https://www.bookthesurprise.com/surprise/taste-the-darknessthe-secret-supper/,3999.0,5.0,no description,experiences,Party-Surprises,16199,comment-10755
Surprise Date,https://www.bookthesurprise.com/surprise/surprise-date/,3999.0,5.0,no description,experiences,Party-Surprises,18003,comment-10757
The Great Escape,https://www.bookthesurprise.com/surprise/the-great-escape/,3999.0,5.0,no description,experiences,Party-Surprises,18067,comment-10756
Surprise Visit to Old Age Home,https://www.bookthesurprise.com/surprise/surprise-visit-to-old-age-home/,3999.0,5.0,no description,experiences,Party-Surprises,18070,comment-10950
Hug Me Balloon Surprise Box,https://www.bookthesurprise.com/surprise/hug-me-balloon-surprise-box/,3999.0,5.0,no description,experiences,Party-Surprises,18081,comment-10878
Open Me Surprise Balloon Box,https://www.bookthesurprise.com/surprise/open-me-surprise-balloon-box/,3999.0,5.0,no description,experiences,Party-Surprises,18184,comment-10879
Surprise Visit to Orphanage – Bangalore,https://www.bookthesurprise.com/surprise/surprise-visit-to-orphanage-bangalore/,3999.0,5.0,no description,experiences,Party-Surprises,33190,comment-10976
Surprise Visit to Old Age Home – Bangalore,https://www.bookthesurprise.com/surprise/surprise-visit-to-old-age-home-bangalore/,4999.0,5.0,no description,experiences,Party-Surprises,18194,comment-10980
Message At Your Doorstep,https://www.bookthesurprise.com/surprise/message-at-your-doorstep/,4999.0,5.0,no description,experiences,Party-Surprises,33141,comment-11249
Experience Pottery,https://www.bookthesurprise.com/surprise/experience-pottery/,5299.0,5.0,no description,experiences,Party-Surprises,18118,comment-10982
Surprise In Your Car,https://www.bookthesurprise.com/surprise-in-your-car/,5499.0,5.0,no description,experiences,Party-Surprises,34053,comment-10949
Surprise Visit to Orphanage,https://www.bookthesurprise.com/surprise/surprise-visit-to-orphanage/,5999.0,5.0,no description,experiences,Party-Surprises,18280,comment-10919
Surprise Visit to Pet Cafe,https://www.bookthesurprise.com/surprise/surprise-visit-to-pet-cafe/,5999.0,5.0,no description,experiences,Party-Surprises,34148,comment-11636
Invite Pikachu At Home,https://www.bookthesurprise.com/surprise/invite-pikachu-at-home/,6999.0,5.0,no description,experiences,Party-Surprises,33192,comment-10759
Gift YourSelf,https://www.bookthesurprise.com/surprise/gift-yourself/,8999.0,5.0,no description,experiences,Party-Surprises,18896,comment-10758
Surprise At Airport,https://www.bookthesurprise.com/surprise/surprise-at-airport/,8999.0,5.0,no description,experiences,Party-Surprises,34146,comment-17393
Make Your Home – A Theater,https://www.bookthesurprise.com/surprise/make-your-home-a-theater/,9999.0,5.0,no description,experiences,Party-Surprises,17977,comment-10760
Giant Gift Box – The Ultimate Joy,https://www.bookthesurprise.com/surprise/giant-gift-box-the-ultimate-joy/,9999.0,5.0,no description,experiences,Party-Surprises,18120,comment-10761
Light Up The Sky,https://www.bookthesurprise.com/surprise/light-up-the-sky/,9999.0,5.0,no description,experiences,Party-Surprises,18190,comment-10947
Become a Pilot for a Day,https://www.bookthesurprise.com/surprise/become-a-pilot-for-a-day/,9999.0,5.0,no description,experiences,Party-Surprises,18196,comment-10991
Milk Bath For Couple,https://www.bookthesurprise.com/surprise/milk-bath-for-couple/,11999.0,5.0,no description,experiences,Party-Surprises,34100,comment-10995
Open Top Car Ride,https://www.bookthesurprise.com/surprise/open-top-car-ride/,12599.0,5.0,no description,experiences,Party-Surprises,33143,comment-10764
"Balloons, You & Pikachu!",https://www.bookthesurprise.com/surprise/balloons-you-pikachu/,13999.0,5.0,no description,experiences,Party-Surprises,33686,comment-10765
Avion Joy Ride Surprise,https://www.bookthesurprise.com/avion-joy-ride-surprise/,15999.0,5.0,no description,experiences,Party-Surprises,16519,comment-9782
PVR: Love on the big screen!,https://www.bookthesurprise.com/surprise/pvr-love-on-the-big-screen/,15999.0,5.0,no description,experiences,Party-Surprises,17968,comment-10773
Royal Chariot Ride,https://www.bookthesurprise.com/surprise/royal-chariot-ride/,15999.0,5.0,no description,experiences,Party-Surprises,34005,comment-10767
Cabana At 5Star,https://www.bookthesurprise.com/surprise/cabana-at-5star/,19999.0,5.0,no description,experiences,Party-Surprises,18061,comment-10762
Cabana At Home,https://www.bookthesurprise.com/surprise/cabana-at-home/,19999.0,5.0,no description,experiences,Party-Surprises,18117,comment-10798
A Day Full of Surprises,https://www.bookthesurprise.com/surprise/a-day-full-of-surprises/,19999.0,5.0,no description,experiences,Party-Surprises,18188,comment-10948
Archery Game – Become the Warrior!,https://www.bookthesurprise.com/surprise/archery-game-become-the-warrior/,999.0,5.0,Unleash The Hidden Shooter Within You. Book The Slot for An Archery Game,experiences-in-bangalore,Premium-Surprises,18092,comment-10962
Blow Me Balloon Gift Box,https://www.bookthesurprise.com/surprise/blow-me-balloon-gift-box/,1099.0,5.0,Send Infinite Joy and Love Packed in the Balloon Box – Blow Your Happiness Out! ,experiences-in-bangalore,Premium-Surprises,18102,comment-10877
Pop Me Balloon Surprise,https://www.bookthesurprise.com/surprise/pop-me-balloon-surprise/,1499.0,5.0,Let Your Dear Ones Pop The Balloon to Know The Secret Wish Sent By You!,experiences-in-bangalore,Premium-Surprises,18192,comment-10882
A Surprise Shooting Game,https://www.bookthesurprise.com/surprise/a-surprise-shooting-game/,1999.0,5.0,Raise Your Gun. Aim At The Point. Shoot it Like A Pro! ,experiences-in-bangalore,Premium-Surprises,18180,comment-10968
Escape Room,https://www.bookthesurprise.com/surprise/escape-room/,2499.0,5.0,Got The Brain of Investigation & Decoding The Clues? Try Escaping The Room! ,experiences-in-bangalore,Premium-Surprises,18070,comment-10970
Hug Me Balloon Surprise Box,https://www.bookthesurprise.com/surprise/hug-me-balloon-surprise-box/,3999.0,5.0,"In a world where everyone is busy gifting the teddies, get ready to gift something much cuter than the teddy – A Teddy Stuffed Inside A Giant Balloon! ",experiences-in-bangalore,Premium-Surprises,18081,comment-10878
Open Me Surprise Balloon Box,https://www.bookthesurprise.com/surprise/open-me-surprise-balloon-box/,3999.0,5.0,The Box Opens and There It Is! – Something Unbelievable,experiences-in-bangalore,Premium-Surprises,18184,comment-10879
Surprise Visit to Orphanage – Bangalore,https://www.bookthesurprise.com/surprise/surprise-visit-to-orphanage-bangalore/,3999.0,5.0,Spend Your Special Day With The Little Dreamers! Plan A Surprise Visit to Orphanage at Bangalore,experiences-in-bangalore,Premium-Surprises,18186,comment-10976
Surprise Visit to Old Age Home – Bangalore,https://www.bookthesurprise.com/surprise/surprise-visit-to-old-age-home-bangalore/,4999.0,5.0,Spend Your Special Day With The Old & Abandoned! Plan A Surprise Visit to Old Age Home at Bangalore,experiences-in-bangalore,Premium-Surprises,18178,comment-10980
Experience Pottery,https://www.bookthesurprise.com/surprise/experience-pottery/,5299.0,5.0,Ever Experienced The Joy of Moulding Earthen Pots With Your Own Hands? ,experiences-in-bangalore,Premium-Surprises,18118,comment-10982
Surprise In Your Car,https://www.bookthesurprise.com/surprise-in-your-car/,5499.0,5.0,Arrange A Magnificent Surprise In The Car Trunk! ,experiences-in-bangalore,Premium-Surprises,18280,comment-10949
Surprise Visit to Pet Cafe,https://www.bookthesurprise.com/surprise/surprise-visit-to-pet-cafe/,5999.0,5.0,Take Your Dog Lover Person to The Best Dog Cafe for Some Furry Time at Bangalore!,experiences-in-bangalore,Premium-Surprises,17997,comment-11636
Invite Pikachu At Home,https://www.bookthesurprise.com/surprise/invite-pikachu-at-home/,6999.0,5.0,"The Pikachu Mascot is Ready To Knock Your Dear One’s Door With Balloons, Sweet Treats & A Special Wish From You! ",experiences-in-bangalore,Premium-Surprises,17987,comment-10759
Gift YourSelf,https://www.bookthesurprise.com/surprise/gift-yourself/,8999.0,5.0,The Door Bell Rings & There’s A Hidden Surprise! ,experiences-in-bangalore,Premium-Surprises,17974,comment-10758
Make Your Home – A Theater,https://www.bookthesurprise.com/surprise/make-your-home-a-theater/,9999.0,5.0,A Surprise Arrangement To Turn Your Home into A Theater! ,experiences-in-bangalore,Premium-Surprises,17977,comment-10760
Giant Gift Box – The Ultimate Joy,https://www.bookthesurprise.com/surprise/giant-gift-box-the-ultimate-joy/,9999.0,5.0,"A Surprise Box That Hides Happiness, Sweet Delights, Special Message & Unlimited Fun With Our Team! ",experiences-in-bangalore,Premium-Surprises,18120,comment-10761
Light Up The Sky,https://www.bookthesurprise.com/surprise/light-up-the-sky/,9999.0,5.0,Take Your Dear Ones BlinfoldedTo This Place & Let Them Experience A Surprise Burst of Crackers in The Sky!,experiences-in-bangalore,Premium-Surprises,18190,comment-10947
Become a Pilot for a Day,https://www.bookthesurprise.com/surprise/become-a-pilot-for-a-day/,9999.0,5.0,Adventerous at Heart? Grab The Chance to Ride The Airplane Under Proper Professional Guidance!,experiences-in-bangalore,Premium-Surprises,18196,comment-10991
Milk Bath For Couple,https://www.bookthesurprise.com/surprise/milk-bath-for-couple/,11999.0,5.0,A Bath Tub Of Milk Decorated With Rose Petals is Waiting for Just The Two of You!,experiences-in-bangalore,Premium-Surprises,18000,comment-10995
"Balloons, You & Pikachu!",https://www.bookthesurprise.com/surprise/balloons-you-pikachu/,13999.0,5.0,"The Pikachu Mascot is Ready To Knock Your Dear One’s Door With Balloons, Sweet Treats & A Surprise Gift! ",experiences-in-bangalore,Premium-Surprises,18117,comment-10765
A Day Full of Surprises,https://www.bookthesurprise.com/surprise/a-day-full-of-surprises/,19999.0,5.0,A Surprise That Starts At Midnight & Ends in The Evening! Your Loved One Will Receive Surprises Throughout The Day!,experiences-in-bangalore,Premium-Surprises,18182,comment-10948
Cabana Along Poolside,https://www.bookthesurprise.com/surprise/cabana-along-poolside/,29999.0,5.0,Spend The Most Romantic Moments In Cabana Arranged Along The Poolside,experiences-in-bangalore,Premium-Surprises,33120,comment-11000
Certificate for Dad,https://www.bookthesurprise.com/surprise/certificate-for-dad/,299.0,5.0,Does Your Dad Have Entrepreneur Qualities? He Must Be A Dad-Preneur Which Is Why he Deserves This!,fathers-day-gifts,Surprise-Gifts,18429,comment-12772
Papa – The Forever Superhero,https://www.bookthesurprise.com/surprise/papa-the-forever-superhero/,499.0,5.0,A Classic Coffee Mug for Your Real Life Super-Hero! – Your Amazing Papa!,fathers-day-gifts,Surprise-Gifts,18404,comment-12665
Personalized Fathers Day Mug,https://www.bookthesurprise.com/surprise/personalized-fathers-day-mug/,499.0,5.0,Custom Coffee Mug – Dictionary Definition and A Customised Photograph of Your Dad! ,fathers-day-gifts,Surprise-Gifts,18409,comment-12598
Magnet Memoire With DAD,https://www.bookthesurprise.com/surprise/magnet-memoire-with-dad/,899.0,5.0,Let The Special Memories With Your Dad Stick With You Forever With These Custom Fridge Magnets!,fathers-day-gifts,Surprise-Gifts,18398,comment-12390
The Photo Easel – For Dad,https://www.bookthesurprise.com/surprise/the-photo-easel-for-dad/,899.0,5.0,A Memory That Walks Your Dad Down The Memory Lane Everytime He Looks At It! ,fathers-day-gifts,Surprise-Gifts,18419,comment-12782
Monogram Cushion For Father,https://www.bookthesurprise.com/surprise/monogram-cushion-for-father/,999.0,5.0,Get Your Dad’s Best Photographs Customised Inside Your Dad’s Favourite Alphabet! ,fathers-day-gifts,Surprise-Gifts,18401,comment-12392
Gift a Tree to Dad,https://www.bookthesurprise.com/surprise/tree-gift-for-dad/,999.0,5.0,Dedicate A Tree to Your Dad With Just One Click! Earn A Rewarding Certificate As The Proof! ,fathers-day-gifts,Surprise-Gifts,18432,comment-12784
Photo Booklet for Dad,https://www.bookthesurprise.com/surprise/photo-booklet-for-dad/,999.0,5.0,A Book of Beautiful Memories for Your Dearest Dad! ,fathers-day-gifts,Surprise-Gifts,18435,comment-12788
Personalized Photo Frame for Dad,https://www.bookthesurprise.com/surprise/personalized-photo-frame-for-dad/,1299.0,5.0,Get Your Dad’s Coolest Pictures Customised Inside The Photo Frame! ,fathers-day-gifts,Surprise-Gifts,18423,comment-12780
Worlds Bestest Father,https://www.bookthesurprise.com/surprise/worlds-bestest-father/,1399.0,5.0,Surprise Boxes With Each Box Disclosing Something Special for Your Dad!,fathers-day-gifts,Surprise-Gifts,18439,comment-12774
Name A Star,https://www.bookthesurprise.com/surprise/name-a-star/,2099.0,5.0,You May Not Be Able to Touch The Stars But We Got Something Greater Than That For Someone You Love! ,fathers-day-gifts,Surprise-Gifts,18111,comment-10922
Caricature Gift for Dad,https://www.bookthesurprise.com/surprise/caricature-gift-for-dad/,4999.0,5.0,"Ever wondered what a cartoon version of your dad looks like, get this caricature gift and find out",fathers-day-gifts,Surprise-Gifts,18445,comment-12778
Classic Father’s Day Surprise,https://www.bookthesurprise.com/surprise/classic-father-s-day-surprise/,7099.0,5.0,"Surprise With Delicious Cake, Balloons, & Sweet Somethings",fathers-day-surprises,Party-Surprises,18368,comment-11939
Delightful Father’s Day Surprise,https://www.bookthesurprise.com/surprise/delightful-father-s-day-surprise/,9099.0,5.0,Surprise With Something Much More Magical Than Cake & Balloons!,fathers-day-surprises,Party-Surprises,18359,comment-11941
Majestic Father’s Day Surprise,https://www.bookthesurprise.com/surprise/majestic-father-s-day-surprise/,11999.0,5.0,Surprise With Celebratory Elements And CELEBRATION WITH A CAUSE – Make This Father’s Day Count!,fathers-day-surprises,Party-Surprises,18350,comment-11943
BTS Charming Red Roses,https://www.bookthesurprise.com/surprise/bts-charming-red-roses/,399.0,5.0,A bouquet of 8 charming red roses packed with red packing paper,flower-delivery-in-chennai,Party-Surprises,15873,comment-9765
BTS Desirable Yellow Roses,https://www.bookthesurprise.com/surprise/bts-desirable-yellow-roses/,399.0,5.0,A bouquet of 8 charming yellow roses packed with yellow packing paper,flower-delivery-in-chennai,Party-Surprises,15879,comment-9894
BTS Beautiful Pink Combination,https://www.bookthesurprise.com/surprise/bts-beautiful-pink-combination/,549.0,5.0,A bouquet of 10 charming pink carnations packed with pink packing paper,flower-delivery-in-chennai,Party-Surprises,15863,comment-9896
BTS Charm,https://www.bookthesurprise.com/surprise/bts-charm/,599.0,5.0,A bouquet of charming pink roses packed with fillers and packed with pink packing paper,flower-delivery-in-chennai,Party-Surprises,15827,comment-9898
BTS Beautiful Carnation Bunch,https://www.bookthesurprise.com/surprise/bts-beautiful-carnation-bunch/,599.0,5.0,A bouquet of 12 charming red carnations and fillers packed with red packing paper,flower-delivery-in-chennai,Party-Surprises,15848,comment-9900
BTS Pretty In Pink,https://www.bookthesurprise.com/surprise/bts-pretty-in-pink/,699.0,5.0,A cute basket of 8 pink and 4 white carnations with fillers,flower-delivery-in-chennai,Party-Surprises,15833,comment-9902
BTS Amezing Carnation Carnival,https://www.bookthesurprise.com/surprise/bts-amezing-carnation-carnival/,749.0,5.0,A bouquet of 15 charming pink carnations and fillers packed with blue packing paper,flower-delivery-in-chennai,Party-Surprises,15853,comment-9904
BTS Perform My Love,https://www.bookthesurprise.com/surprise/bts-perform-my-love/,799.0,5.0,A beautiful flower arrangement of roses that your dear one will love,flower-delivery-in-chennai,Party-Surprises,15822,comment-9906
BTS A True Hug,https://www.bookthesurprise.com/surprise/bts-a-true-hug/,899.0,5.0,A bouquet of 20 charming pink carnations packed with white packing paper,flower-delivery-in-chennai,Party-Surprises,15843,comment-9908
BTS Perfect Charm Bouquet,https://www.bookthesurprise.com/surprise/bts-perfect-charm-bouquet/,899.0,5.0,A bouquet of charming orchids packed with pink packing paper,flower-delivery-in-chennai,Party-Surprises,17141,comment-9910
BTS Lovely Pink,https://www.bookthesurprise.com/surprise/bts-lovely-pink/,949.0,5.0,A beautiful flower arrangement of pink roses that your dear one will love,flower-delivery-in-chennai,Party-Surprises,15838,comment-9912
BTS Romantic Love,https://www.bookthesurprise.com/surprise/bts-romantic-love/,949.0,5.0,A cute basket of 20 pink carnations decorated with green fillers,flower-delivery-in-chennai,Party-Surprises,15858,comment-9914
BTS Memorable Expression,https://www.bookthesurprise.com/surprise/bts-memorable-expression/,949.0,5.0,A bouquet of 10 charming red roses decorated with fillers and packed with red packing paper,flower-delivery-in-chennai,Party-Surprises,15868,comment-9916
BTS Wonderful Twenty,https://www.bookthesurprise.com/surprise/bts-wonderful-twenty/,1049.0,5.0,A bouquet of 20 long stem red roses decorated with fillers and packed with orange packing paper,flower-delivery-in-chennai,Party-Surprises,15817,comment-9918
BTS A BIG Affection N Love,https://www.bookthesurprise.com/surprise/bts-a-big-affection-n-love/,2399.0,5.0,A huge bouquet of 50 red roses to show your heartfelt affection,flower-delivery-in-chennai,Party-Surprises,15812,comment-9920
BTS Charming Red Roses,https://www.bookthesurprise.com/surprise/bts-charming-red-roses/,399.0,5.0,A bouquet of 8 charming red roses packed with red packing paper,flower-delivery-in-delhi,Party-Surprises,15873,comment-9765
BTS Desirable Yellow Roses,https://www.bookthesurprise.com/surprise/bts-desirable-yellow-roses/,399.0,5.0,A bouquet of 8 charming yellow roses packed with yellow packing paper,flower-delivery-in-delhi,Party-Surprises,15879,comment-9894
BTS Beautiful Pink Combination,https://www.bookthesurprise.com/surprise/bts-beautiful-pink-combination/,549.0,5.0,A bouquet of 10 charming pink carnations packed with pink packing paper,flower-delivery-in-delhi,Party-Surprises,15863,comment-9896
BTS Charm,https://www.bookthesurprise.com/surprise/bts-charm/,599.0,5.0,A bouquet of charming pink roses packed with fillers and packed with pink packing paper,flower-delivery-in-delhi,Party-Surprises,15827,comment-9898
BTS Beautiful Carnation Bunch,https://www.bookthesurprise.com/surprise/bts-beautiful-carnation-bunch/,599.0,5.0,A bouquet of 12 charming red carnations and fillers packed with red packing paper,flower-delivery-in-delhi,Party-Surprises,15848,comment-9900
BTS Pretty In Pink,https://www.bookthesurprise.com/surprise/bts-pretty-in-pink/,699.0,5.0,A cute basket of 8 pink and 4 white carnations with fillers,flower-delivery-in-delhi,Party-Surprises,15833,comment-9902
BTS Amezing Carnation Carnival,https://www.bookthesurprise.com/surprise/bts-amezing-carnation-carnival/,749.0,5.0,A bouquet of 15 charming pink carnations and fillers packed with blue packing paper,flower-delivery-in-delhi,Party-Surprises,15853,comment-9904
BTS Perform My Love,https://www.bookthesurprise.com/surprise/bts-perform-my-love/,799.0,5.0,A beautiful flower arrangement of roses that your dear one will love,flower-delivery-in-delhi,Party-Surprises,15822,comment-9906
BTS A True Hug,https://www.bookthesurprise.com/surprise/bts-a-true-hug/,899.0,5.0,A bouquet of 20 charming pink carnations packed with white packing paper,flower-delivery-in-delhi,Party-Surprises,15843,comment-9908
BTS Perfect Charm Bouquet,https://www.bookthesurprise.com/surprise/bts-perfect-charm-bouquet/,899.0,5.0,A bouquet of charming orchids packed with pink packing paper,flower-delivery-in-delhi,Party-Surprises,17141,comment-9910
BTS Lovely Pink,https://www.bookthesurprise.com/surprise/bts-lovely-pink/,949.0,5.0,A beautiful flower arrangement of pink roses that your dear one will love,flower-delivery-in-delhi,Party-Surprises,15838,comment-9912
BTS Romantic Love,https://www.bookthesurprise.com/surprise/bts-romantic-love/,949.0,5.0,A cute basket of 20 pink carnations decorated with green fillers,flower-delivery-in-delhi,Party-Surprises,15858,comment-9914
BTS Memorable Expression,https://www.bookthesurprise.com/surprise/bts-memorable-expression/,949.0,5.0,A bouquet of 10 charming red roses decorated with fillers and packed with red packing paper,flower-delivery-in-delhi,Party-Surprises,15868,comment-9916
BTS Wonderful Twenty,https://www.bookthesurprise.com/surprise/bts-wonderful-twenty/,1049.0,5.0,A bouquet of 20 long stem red roses decorated with fillers and packed with orange packing paper,flower-delivery-in-delhi,Party-Surprises,15817,comment-9918
BTS A BIG Affection N Love,https://www.bookthesurprise.com/surprise/bts-a-big-affection-n-love/,2399.0,5.0,A huge bouquet of 50 red roses to show your heartfelt affection,flower-delivery-in-delhi,Party-Surprises,15812,comment-9920
BTS Charming Red Roses,https://www.bookthesurprise.com/surprise/bts-charming-red-roses/,399.0,5.0,A bouquet of 8 charming red roses packed with red packing paper,flower-delivery-in-kolkata,Party-Surprises,15873,comment-9765
BTS Desirable Yellow Roses,https://www.bookthesurprise.com/surprise/bts-desirable-yellow-roses/,399.0,5.0,A bouquet of 8 charming yellow roses packed with yellow packing paper,flower-delivery-in-kolkata,Party-Surprises,15879,comment-9894
BTS Beautiful Pink Combination,https://www.bookthesurprise.com/surprise/bts-beautiful-pink-combination/,549.0,5.0,A bouquet of 10 charming pink carnations packed with pink packing paper,flower-delivery-in-kolkata,Party-Surprises,15863,comment-9896
BTS Charm,https://www.bookthesurprise.com/surprise/bts-charm/,599.0,5.0,A bouquet of charming pink roses packed with fillers and packed with pink packing paper,flower-delivery-in-kolkata,Party-Surprises,15827,comment-9898
BTS Beautiful Carnation Bunch,https://www.bookthesurprise.com/surprise/bts-beautiful-carnation-bunch/,599.0,5.0,A bouquet of 12 charming red carnations and fillers packed with red packing paper,flower-delivery-in-kolkata,Party-Surprises,15848,comment-9900
BTS Pretty In Pink,https://www.bookthesurprise.com/surprise/bts-pretty-in-pink/,699.0,5.0,A cute basket of 8 pink and 4 white carnations with fillers,flower-delivery-in-kolkata,Party-Surprises,15833,comment-9902
BTS Amezing Carnation Carnival,https://www.bookthesurprise.com/surprise/bts-amezing-carnation-carnival/,749.0,5.0,A bouquet of 15 charming pink carnations and fillers packed with blue packing paper,flower-delivery-in-kolkata,Party-Surprises,15853,comment-9904
BTS Perform My Love,https://www.bookthesurprise.com/surprise/bts-perform-my-love/,799.0,5.0,A beautiful flower arrangement of roses that your dear one will love,flower-delivery-in-kolkata,Party-Surprises,15822,comment-9906
BTS A True Hug,https://www.bookthesurprise.com/surprise/bts-a-true-hug/,899.0,5.0,A bouquet of 20 charming pink carnations packed with white packing paper,flower-delivery-in-kolkata,Party-Surprises,15843,comment-9908
BTS Perfect Charm Bouquet,https://www.bookthesurprise.com/surprise/bts-perfect-charm-bouquet/,899.0,5.0,A bouquet of charming orchids packed with pink packing paper,flower-delivery-in-kolkata,Party-Surprises,17141,comment-9910
BTS Lovely Pink,https://www.bookthesurprise.com/surprise/bts-lovely-pink/,949.0,5.0,A beautiful flower arrangement of pink roses that your dear one will love,flower-delivery-in-kolkata,Party-Surprises,15838,comment-9912
BTS Romantic Love,https://www.bookthesurprise.com/surprise/bts-romantic-love/,949.0,5.0,A cute basket of 20 pink carnations decorated with green fillers,flower-delivery-in-kolkata,Party-Surprises,15858,comment-9914
BTS Memorable Expression,https://www.bookthesurprise.com/surprise/bts-memorable-expression/,949.0,5.0,A bouquet of 10 charming red roses decorated with fillers and packed with red packing paper,flower-delivery-in-kolkata,Party-Surprises,15868,comment-9916
BTS Wonderful Twenty,https://www.bookthesurprise.com/surprise/bts-wonderful-twenty/,1049.0,5.0,A bouquet of 20 long stem red roses decorated with fillers and packed with orange packing paper,flower-delivery-in-kolkata,Party-Surprises,15817,comment-9918
BTS A BIG Affection N Love,https://www.bookthesurprise.com/surprise/bts-a-big-affection-n-love/,2399.0,5.0,A huge bouquet of 50 red roses to show your heartfelt affection,flower-delivery-in-kolkata,Party-Surprises,15812,comment-9920
BTS Charming Red Roses,https://www.bookthesurprise.com/surprise/bts-charming-red-roses/,399.0,5.0,A bouquet of 8 charming red roses packed with red packing paper,flower-delivery-in-mumbai,Party-Surprises,15873,comment-9765
BTS Desirable Yellow Roses,https://www.bookthesurprise.com/surprise/bts-desirable-yellow-roses/,399.0,5.0,A bouquet of 8 charming yellow roses packed with yellow packing paper,flower-delivery-in-mumbai,Party-Surprises,15879,comment-9894
BTS Beautiful Pink Combination,https://www.bookthesurprise.com/surprise/bts-beautiful-pink-combination/,549.0,5.0,A bouquet of 10 charming pink carnations packed with pink packing paper,flower-delivery-in-mumbai,Party-Surprises,15863,comment-9896
